Post_id,User_id,Recipient_id,Content,Type_is,Visible,Created_at
1,237,516,cum sociis natoque penatibus et,Message,1,2/24/24
2,365,273,amet turpis elementum ligula vehicula consequat morbi a ipsum integer,Message,0,2/17/24
3,74,858,praesent id massa id nisl,Message,0,2/6/24
4,870,818,interdum mauris non ligula pellentesque,Message,0,2/24/24
5,945,518,dictumst morbi vestibulum velit id pretium iaculis diam erat,Message,1,2/20/24
6,984,989,sit amet nulla quisque arcu libero rutrum,Message,1,2/3/24
7,852,835,id lobortis convallis tortor risus dapibus augue vel,Message,0,2/23/24
8,260,182,ac tellus semper interdum mauris,Message,0,2/1/24
9,227,705,donec quis orci eget orci,Message,0,2/2/24
10,348,321,ut rhoncus aliquet pulvinar sed nisl nunc,Message,1,2/9/24
11,30,802,dui luctus rutrum nulla tellus,Message,1,2/24/24
12,314,780,pretium quis lectus suspendisse potenti in eleifend quam,Message,0,2/7/24
13,539,530,platea dictumst etiam faucibus cursus,Message,0,2/14/24
14,356,859,semper est quam pharetra magna ac consequat metus sapien ut,Message,0,2/19/24
15,564,897,nullam porttitor lacus at turpis donec posuere metus vitae,Message,0,2/4/24
16,788,27,ut blandit non interdum in ante vestibulum ante ipsum,Message,0,2/13/24
17,260,281,in magna bibendum imperdiet nullam orci pede venenatis,Message,0,2/15/24
18,624,873,pharetra magna ac consequat metus sapien ut nunc,Message,0,2/22/24
19,653,962,pellentesque ultrices phasellus id sapien in,Message,0,2/23/24
20,652,39,luctus et ultrices posuere cubilia,Message,1,2/19/24
21,985,420,libero non mattis pulvinar nulla pede ullamcorper augue a,Message,0,2/20/24
22,795,936,turpis integer aliquet massa id lobortis convallis,Message,1,2/10/24
23,96,56,donec vitae nisi nam ultrices libero,Message,1,2/11/24
24,516,247,quis turpis sed ante vivamus,Message,0,2/24/24
25,575,915,hac habitasse platea dictumst aliquam augue quam sollicitudin,Message,0,2/9/24
26,691,517,porttitor lorem id ligula suspendisse ornare consequat,Message,1,2/17/24
27,633,692,ipsum primis in faucibus orci luctus et ultrices,Message,0,2/2/24
28,808,990,in libero ut massa volutpat convallis morbi odio odio,Message,1,2/4/24
29,791,673,mauris enim leo rhoncus sed vestibulum sit amet cursus,Message,1,2/2/24
30,821,948,lacinia nisi venenatis tristique fusce congue diam id ornare,Message,1,2/22/24
31,674,507,consequat metus sapien ut nunc vestibulum ante ipsum primis in,Message,1,2/2/24
32,599,644,in leo maecenas pulvinar lobortis est phasellus sit amet,Message,1,2/5/24
33,975,692,et ultrices posuere cubilia curae duis faucibus,Message,0,2/16/24
34,527,362,justo in hac habitasse platea dictumst etiam,Message,0,2/11/24
35,564,695,non mauris morbi non lectus aliquam sit,Message,0,2/23/24
36,5,876,at turpis donec posuere metus vitae ipsum aliquam non mauris,Message,1,2/2/24
37,610,661,ac leo pellentesque ultrices mattis odio donec vitae nisi nam,Message,0,2/6/24
38,985,416,mi in porttitor pede justo eu massa donec dapibus,Message,0,2/24/24
39,986,54,lectus in est risus auctor sed tristique in tempus sit,Message,0,2/25/24
40,693,876,ac leo pellentesque ultrices mattis odio,Message,0,2/18/24
41,824,510,duis ac nibh fusce lacus,Message,1,2/15/24
42,234,839,quisque id justo sit amet,Message,0,2/25/24
43,578,762,justo nec condimentum neque sapien placerat,Message,0,2/17/24
44,999,792,sit amet cursus id turpis integer aliquet massa,Message,1,2/18/24
45,408,329,at nulla suspendisse potenti cras in purus eu,Message,1,2/12/24
46,536,120,sollicitudin mi sit amet lobortis sapien,Message,0,2/4/24
47,531,440,potenti in eleifend quam a odio in hac,Message,0,2/24/24
48,727,634,tristique fusce congue diam id ornare imperdiet sapien urna,Message,0,2/10/24
49,741,563,nulla ultrices aliquet maecenas leo odio condimentum id luctus,Message,1,2/9/24
50,503,535,pede posuere nonummy integer non velit donec diam neque,Message,1,2/22/24
51,272,619,ante vel ipsum praesent blandit lacinia erat vestibulum sed magna,Message,0,2/14/24
52,9,76,orci pede venenatis non sodales sed,Message,1,2/14/24
53,742,564,placerat ante nulla justo aliquam quis turpis eget elit sodales,Message,1,2/17/24
54,392,964,mi in porttitor pede justo eu massa donec dapibus duis,Message,1,2/20/24
55,367,264,morbi a ipsum integer a nibh,Message,0,2/4/24
56,606,189,iaculis congue vivamus metus arcu adipiscing molestie hendrerit at,Message,1,2/8/24
57,59,914,quis justo maecenas rhoncus aliquam lacus,Message,0,2/11/24
58,804,17,pretium iaculis diam erat fermentum justo nec condimentum,Message,0,2/5/24
59,331,599,magna vulputate luctus cum sociis natoque penatibus,Message,1,2/4/24
60,846,819,scelerisque mauris sit amet eros suspendisse,Message,0,2/16/24
61,495,342,bibendum felis sed interdum venenatis turpis enim blandit mi in,Message,0,2/5/24
62,807,498,dapibus duis at velit eu est congue elementum in hac,Message,1,2/19/24
63,708,408,aenean fermentum donec ut mauris eget massa,Message,0,2/1/24
64,8,373,ante nulla justo aliquam quis turpis eget elit sodales scelerisque,Message,0,2/16/24
65,54,223,libero nam dui proin leo odio porttitor id,Message,0,2/24/24
66,390,578,pede morbi porttitor lorem id ligula suspendisse ornare consequat lectus,Message,1,2/6/24
67,303,920,sed augue aliquam erat volutpat in,Message,1,2/11/24
68,911,456,quis orci nullam molestie nibh in lectus pellentesque,Message,1,2/17/24
69,380,913,in lectus pellentesque at nulla suspendisse potenti,Message,1,2/5/24
70,447,485,lacus curabitur at ipsum ac tellus semper interdum,Message,0,2/1/24
71,664,642,facilisi cras non velit nec,Message,0,2/24/24
72,931,271,augue quam sollicitudin vitae consectetuer eget,Message,1,2/20/24
73,324,798,sed vel enim sit amet nunc,Message,0,2/18/24
74,14,521,nulla justo aliquam quis turpis eget elit,Message,0,2/16/24
75,317,670,maecenas tristique est et tempus semper est quam,Message,0,2/17/24
76,66,317,congue elementum in hac habitasse platea dictumst morbi vestibulum,Message,0,2/12/24
77,540,463,est congue elementum in hac habitasse platea,Message,1,2/11/24
78,37,262,blandit ultrices enim lorem ipsum dolor sit amet consectetuer adipiscing,Message,1,2/15/24
79,888,632,imperdiet sapien urna pretium nisl ut volutpat sapien,Message,0,2/2/24
80,837,597,in consequat ut nulla sed accumsan felis,Message,0,2/3/24
81,403,202,sapien cursus vestibulum proin eu mi nulla ac enim in,Message,1,2/13/24
82,146,749,praesent lectus vestibulum quam sapien varius,Message,0,2/3/24
83,417,476,nunc rhoncus dui vel sem sed,Message,0,2/14/24
84,202,126,adipiscing elit proin risus praesent lectus vestibulum,Message,0,2/4/24
85,991,207,mauris sit amet eros suspendisse accumsan tortor quis turpis sed,Message,1,2/20/24
86,714,823,enim leo rhoncus sed vestibulum sit amet,Message,1,2/15/24
87,281,422,elit proin interdum mauris non,Message,0,2/9/24
88,235,687,elit proin risus praesent lectus vestibulum,Message,0,2/3/24
89,461,760,dolor quis odio consequat varius integer ac leo,Message,0,2/6/24
90,665,637,mi in porttitor pede justo eu massa donec dapibus,Message,0,2/13/24
91,649,357,tincidunt in leo maecenas pulvinar lobortis est,Message,1,2/2/24
92,709,77,natoque penatibus et magnis dis parturient montes nascetur ridiculus mus,Message,1,2/4/24
93,467,8,praesent blandit lacinia erat vestibulum sed magna at,Message,1,2/24/24
94,774,17,lectus in quam fringilla rhoncus mauris,Message,0,2/23/24
95,637,956,interdum mauris non ligula pellentesque ultrices phasellus id sapien in,Message,0,2/15/24
96,262,718,nunc rhoncus dui vel sem sed,Message,1,2/1/24
97,289,880,nisi nam ultrices libero non mattis pulvinar nulla pede ullamcorper,Message,1,2/19/24
98,881,267,purus sit amet nulla quisque arcu libero,Message,0,2/1/24
99,377,131,in sagittis dui vel nisl duis ac nibh,Message,0,2/16/24
100,868,442,ipsum primis in faucibus orci,Message,1,2/9/24
101,651,581,pharetra magna ac consequat metus,Message,1,2/10/24
102,667,367,id sapien in sapien iaculis congue vivamus metus,Message,1,2/9/24
103,982,368,velit vivamus vel nulla eget eros elementum pellentesque quisque porta,Message,0,2/16/24
104,700,897,et ultrices posuere cubilia curae donec pharetra magna,Message,1,2/24/24
105,110,164,ut massa quis augue luctus,Message,1,2/22/24
106,291,896,in lacus curabitur at ipsum ac tellus semper,Message,0,2/16/24
107,523,498,mattis egestas metus aenean fermentum,Message,1,2/15/24
108,712,485,sed vel enim sit amet nunc viverra,Message,1,2/12/24
109,386,793,id pretium iaculis diam erat,Message,0,2/3/24
110,855,747,vestibulum sagittis sapien cum sociis,Message,1,2/14/24
111,145,495,dolor vel est donec odio justo sollicitudin,Message,1,2/18/24
112,4,73,sapien placerat ante nulla justo,Message,1,2/8/24
113,141,437,non sodales sed tincidunt eu felis fusce posuere felis,Message,1,2/25/24
114,665,307,eleifend quam a odio in hac,Message,1,2/7/24
115,868,782,enim sit amet nunc viverra dapibus,Message,1,2/17/24
116,719,943,nullam molestie nibh in lectus pellentesque,Message,0,2/21/24
117,770,973,in hac habitasse platea dictumst,Message,1,2/1/24
118,564,601,non velit donec diam neque vestibulum eget,Message,0,2/10/24
119,667,677,turpis nec euismod scelerisque quam turpis adipiscing lorem vitae mattis,Message,1,2/20/24
120,737,746,luctus rutrum nulla tellus in sagittis,Message,0,2/15/24
121,323,180,ac nibh fusce lacus purus aliquet at feugiat,Message,0,2/7/24
122,473,993,dis parturient montes nascetur ridiculus mus etiam vel,Message,0,2/23/24
123,426,797,rutrum ac lobortis vel dapibus at,Message,1,2/14/24
124,964,355,mauris lacinia sapien quis libero nullam sit amet,Message,1,2/5/24
125,888,91,pharetra magna vestibulum aliquet ultrices erat tortor,Message,1,2/7/24
126,551,18,nibh quisque id justo sit amet sapien dignissim vestibulum vestibulum,Message,1,2/9/24
127,398,914,etiam faucibus cursus urna ut tellus nulla ut,Message,0,2/8/24
128,128,792,amet consectetuer adipiscing elit proin interdum mauris,Message,0,2/10/24
129,848,837,quam sollicitudin vitae consectetuer eget rutrum at lorem integer,Message,0,2/21/24
130,488,41,a nibh in quis justo maecenas rhoncus aliquam lacus,Message,1,2/2/24
131,928,388,nunc purus phasellus in felis donec semper,Message,1,2/10/24
132,318,727,felis eu sapien cursus vestibulum proin,Message,1,2/23/24
133,52,181,lacus morbi quis tortor id nulla ultrices aliquet maecenas leo,Message,1,2/16/24
134,744,15,dui vel sem sed sagittis,Message,0,2/15/24
135,505,105,magna at nunc commodo placerat praesent blandit nam,Message,1,2/3/24
136,584,315,aliquet ultrices erat tortor sollicitudin,Message,0,2/10/24
137,712,40,interdum mauris ullamcorper purus sit amet nulla quisque arcu,Message,0,2/24/24
138,418,838,at turpis a pede posuere nonummy integer,Message,0,2/21/24
139,178,489,lobortis ligula sit amet eleifend pede libero quis orci nullam,Message,1,2/2/24
140,303,117,lobortis vel dapibus at diam,Message,0,2/3/24
141,369,938,rutrum nulla nunc purus phasellus in felis donec semper sapien,Message,1,2/12/24
142,818,228,volutpat quam pede lobortis ligula sit amet,Message,0,2/25/24
143,664,256,purus aliquet at feugiat non,Message,1,2/15/24
144,321,429,sapien ut nunc vestibulum ante ipsum primis in,Message,1,2/18/24
145,528,348,tincidunt in leo maecenas pulvinar lobortis est phasellus sit,Message,0,2/25/24
146,66,338,semper est quam pharetra magna ac consequat,Message,1,2/7/24
147,493,607,volutpat dui maecenas tristique est et,Message,0,2/5/24
148,54,564,dis parturient montes nascetur ridiculus mus vivamus,Message,1,2/7/24
149,870,990,pretium nisl ut volutpat sapien,Message,1,2/1/24
150,121,180,quis libero nullam sit amet turpis elementum ligula,Message,0,2/10/24
151,408,789,iaculis justo in hac habitasse platea,Message,1,2/8/24
152,232,134,integer a nibh in quis justo maecenas rhoncus aliquam lacus,Message,0,2/8/24
153,665,367,tellus nulla ut erat id mauris vulputate elementum nullam varius,Message,0,2/1/24
154,332,507,malesuada in imperdiet et commodo vulputate justo in blandit,Message,0,2/12/24
155,672,115,donec vitae nisi nam ultrices libero non mattis,Message,0,2/13/24
156,844,512,mattis egestas metus aenean fermentum donec ut mauris eget massa,Message,0,2/20/24
157,239,510,donec diam neque vestibulum eget vulputate ut,Message,0,2/16/24
158,59,46,justo morbi ut odio cras mi pede malesuada in,Message,1,2/8/24
159,311,190,natoque penatibus et magnis dis parturient montes,Message,1,2/20/24
160,625,209,pulvinar nulla pede ullamcorper augue a suscipit nulla elit,Message,0,2/18/24
161,670,622,pede ac diam cras pellentesque volutpat dui maecenas tristique est,Message,0,2/20/24
162,630,940,volutpat in congue etiam justo etiam pretium iaculis,Message,0,2/19/24
163,305,551,molestie lorem quisque ut erat curabitur gravida nisi at nibh,Message,1,2/13/24
164,545,316,sapien ut nunc vestibulum ante ipsum primis in faucibus,Message,1,2/19/24
165,614,820,eget rutrum at lorem integer tincidunt,Message,0,2/15/24
166,199,861,amet diam in magna bibendum,Message,0,2/2/24
167,294,556,vestibulum vestibulum ante ipsum primis in faucibus orci,Message,0,2/4/24
168,82,836,auctor sed tristique in tempus,Message,1,2/10/24
169,382,913,sit amet diam in magna bibendum imperdiet nullam orci pede,Message,0,2/4/24
170,285,264,nullam sit amet turpis elementum ligula vehicula consequat,Message,0,2/13/24
171,25,614,gravida sem praesent id massa id nisl venenatis,Message,0,2/24/24
172,774,804,etiam vel augue vestibulum rutrum rutrum neque aenean auctor,Message,0,2/11/24
173,144,414,bibendum morbi non quam nec dui luctus,Message,0,2/21/24
174,681,469,volutpat eleifend donec ut dolor morbi vel lectus in quam,Message,0,2/3/24
175,376,116,nulla ultrices aliquet maecenas leo odio condimentum id,Message,0,2/4/24
176,953,774,libero nam dui proin leo odio porttitor,Message,0,2/25/24
177,675,371,luctus et ultrices posuere cubilia curae duis faucibus accumsan odio,Message,0,2/17/24
178,931,487,ut tellus nulla ut erat id mauris,Message,0,2/14/24
179,696,464,phasellus sit amet erat nulla tempus vivamus in felis eu,Message,1,2/23/24
180,78,499,duis consequat dui nec nisi volutpat eleifend,Message,1,2/4/24
181,848,985,ante nulla justo aliquam quis turpis,Message,1,2/12/24
182,974,825,nisi eu orci mauris lacinia sapien,Message,1,2/9/24
183,711,344,diam vitae quam suspendisse potenti nullam,Message,1,2/22/24
184,996,161,aliquet massa id lobortis convallis tortor risus dapibus,Message,1,2/17/24
185,313,549,orci luctus et ultrices posuere cubilia curae mauris,Message,1,2/19/24
186,702,963,lacus curabitur at ipsum ac,Message,1,2/5/24
187,307,849,at nibh in hac habitasse platea dictumst aliquam augue,Message,1,2/10/24
188,828,164,dolor morbi vel lectus in,Message,0,2/24/24
189,209,29,nulla nisl nunc nisl duis bibendum felis sed interdum,Message,0,2/10/24
190,529,636,interdum mauris non ligula pellentesque,Message,0,2/17/24
191,71,768,placerat praesent blandit nam nulla integer pede justo lacinia,Message,1,2/15/24
192,263,521,faucibus accumsan odio curabitur convallis duis,Message,0,2/17/24
193,296,469,vivamus tortor duis mattis egestas metus aenean,Message,0,2/7/24
194,156,995,turpis integer aliquet massa id,Message,0,2/13/24
195,27,853,sagittis nam congue risus semper porta volutpat quam pede,Message,0,2/11/24
196,248,963,ac lobortis vel dapibus at,Message,1,2/23/24
197,399,945,duis mattis egestas metus aenean fermentum donec ut mauris eget,Message,1,2/13/24
198,959,318,orci luctus et ultrices posuere,Message,0,2/13/24
199,20,27,ultrices posuere cubilia curae duis faucibus accumsan odio curabitur,Message,1,2/6/24
200,904,646,est risus auctor sed tristique,Message,0,2/4/24
201,921,741,nibh in quis justo maecenas rhoncus aliquam lacus,Message,0,2/6/24
202,157,660,eros viverra eget congue eget semper rutrum nulla,Message,0,2/8/24
203,888,702,nunc commodo placerat praesent blandit nam nulla integer,Message,0,2/14/24
204,910,824,id pretium iaculis diam erat fermentum justo,Message,1,2/25/24
205,900,255,lacus at velit vivamus vel nulla eget,Message,1,2/17/24
206,958,415,augue vestibulum rutrum rutrum neque aenean auctor gravida sem praesent,Message,1,2/25/24
207,636,261,convallis nunc proin at turpis a pede posuere,Message,0,2/22/24
208,952,806,congue vivamus metus arcu adipiscing molestie hendrerit at vulputate,Message,1,2/21/24
209,460,464,donec dapibus duis at velit eu est congue,Message,1,2/6/24
210,557,483,quam suspendisse potenti nullam porttitor,Message,1,2/7/24
211,925,601,nisi vulputate nonummy maecenas tincidunt lacus,Message,0,2/5/24
212,1,8,metus aenean fermentum donec ut mauris,Message,0,2/25/24
213,730,408,ligula pellentesque ultrices phasellus id sapien in sapien,Message,1,2/20/24
214,302,171,ut blandit non interdum in ante vestibulum ante ipsum,Message,1,2/25/24
215,683,351,metus arcu adipiscing molestie hendrerit at vulputate vitae nisl,Message,1,2/18/24
216,95,396,eget tempus vel pede morbi porttitor lorem id,Message,0,2/13/24
217,197,463,odio cras mi pede malesuada in imperdiet et commodo vulputate,Message,0,2/25/24
218,527,513,eu sapien cursus vestibulum proin eu,Message,0,2/25/24
219,137,364,quis justo maecenas rhoncus aliquam lacus morbi quis tortor id,Message,1,2/23/24
220,433,571,tellus semper interdum mauris ullamcorper purus sit amet,Message,0,2/21/24
221,550,310,lectus suspendisse potenti in eleifend quam a,Message,1,2/1/24
222,25,764,ut ultrices vel augue vestibulum ante ipsum primis in faucibus,Message,1,2/21/24
223,832,504,dictumst maecenas ut massa quis augue luctus tincidunt,Message,1,2/4/24
224,385,365,aliquet massa id lobortis convallis tortor,Message,0,2/24/24
225,187,870,vel accumsan tellus nisi eu orci,Message,0,2/12/24
226,501,79,eleifend donec ut dolor morbi vel lectus in quam,Message,0,2/14/24
227,20,347,a odio in hac habitasse platea,Message,1,2/3/24
228,251,340,amet sem fusce consequat nulla nisl nunc nisl duis bibendum,Message,0,2/7/24
229,357,307,eleifend donec ut dolor morbi vel,Message,1,2/19/24
230,152,155,dapibus augue vel accumsan tellus nisi eu orci mauris,Message,0,2/7/24
231,675,942,at turpis a pede posuere nonummy integer non velit donec,Message,1,2/1/24
232,508,881,cursus urna ut tellus nulla ut erat id mauris,Message,1,2/18/24
233,159,717,aliquet massa id lobortis convallis,Message,0,2/17/24
234,322,612,est donec odio justo sollicitudin,Message,0,2/25/24
235,606,202,nisl aenean lectus pellentesque eget nunc donec quis,Message,0,2/25/24
236,394,993,cursus urna ut tellus nulla ut erat,Message,0,2/2/24
237,589,451,lobortis ligula sit amet eleifend pede libero quis orci,Message,1,2/7/24
238,177,469,nisi eu orci mauris lacinia,Message,0,2/4/24
239,428,108,sit amet sapien dignissim vestibulum vestibulum ante ipsum,Message,1,2/25/24
240,229,476,sem mauris laoreet ut rhoncus,Message,1,2/15/24
241,173,472,sodales sed tincidunt eu felis fusce posuere felis sed lacus,Message,0,2/6/24
242,40,944,ut massa quis augue luctus tincidunt nulla mollis molestie lorem,Message,1,2/19/24
243,513,208,orci luctus et ultrices posuere cubilia,Message,1,2/21/24
244,343,858,tristique fusce congue diam id ornare imperdiet,Message,0,2/23/24
245,633,228,molestie sed justo pellentesque viverra pede ac diam,Message,1,2/14/24
246,174,458,luctus ultricies eu nibh quisque id justo sit amet,Message,1,2/17/24
247,915,401,rhoncus aliquam lacus morbi quis tortor id nulla,Message,0,2/10/24
248,457,194,eget eleifend luctus ultricies eu nibh quisque id justo sit,Message,1,2/12/24
249,567,180,libero non mattis pulvinar nulla pede ullamcorper,Message,1,2/4/24
250,587,633,quisque id justo sit amet sapien,Message,0,2/23/24
251,193,481,duis at velit eu est congue elementum in hac,Message,0,2/3/24
252,749,525,ut mauris eget massa tempor convallis nulla neque,Message,0,2/4/24
253,194,813,orci luctus et ultrices posuere,Message,0,2/6/24
254,540,471,semper interdum mauris ullamcorper purus sit amet nulla,Message,0,2/3/24
255,848,23,in eleifend quam a odio in hac habitasse platea dictumst,Message,1,2/6/24
256,673,76,urna ut tellus nulla ut erat,Message,1,2/13/24
257,594,557,nulla suscipit ligula in lacus curabitur at ipsum ac,Message,0,2/7/24
258,981,64,orci eget orci vehicula condimentum curabitur,Message,1,2/13/24
259,978,984,duis faucibus accumsan odio curabitur convallis,Message,1,2/6/24
260,349,831,porttitor pede justo eu massa donec dapibus duis,Message,0,2/25/24
261,790,32,pellentesque ultrices mattis odio donec vitae nisi nam,Message,1,2/17/24
262,369,217,facilisi cras non velit nec nisi,Message,1,2/14/24
263,12,207,auctor sed tristique in tempus sit,Message,1,2/25/24
264,242,301,et magnis dis parturient montes,Message,0,2/1/24
265,204,431,morbi non lectus aliquam sit amet diam in,Message,1,2/1/24
266,374,286,est quam pharetra magna ac consequat,Message,1,2/4/24
267,445,481,ipsum dolor sit amet consectetuer adipiscing,Message,0,2/11/24
268,285,392,sed vel enim sit amet nunc viverra dapibus,Message,1,2/11/24
269,590,44,nisi volutpat eleifend donec ut dolor morbi,Message,0,2/15/24
270,550,978,ligula nec sem duis aliquam convallis nunc proin at turpis,Message,0,2/1/24
271,103,414,praesent blandit lacinia erat vestibulum sed magna at,Message,1,2/8/24
272,767,759,placerat ante nulla justo aliquam quis,Message,1,2/25/24
273,714,451,tincidunt eget tempus vel pede,Message,0,2/22/24
274,302,953,venenatis lacinia aenean sit amet justo morbi ut,Message,0,2/20/24
275,691,173,sem mauris laoreet ut rhoncus aliquet,Message,1,2/9/24
276,8,876,posuere cubilia curae donec pharetra,Message,1,2/16/24
277,434,951,ipsum dolor sit amet consectetuer adipiscing elit proin risus,Message,1,2/16/24
278,272,17,nulla integer pede justo lacinia eget tincidunt eget,Message,1,2/7/24
279,832,56,maecenas tristique est et tempus semper est quam pharetra magna,Message,0,2/11/24
280,197,402,luctus ultricies eu nibh quisque id justo sit,Message,1,2/23/24
281,297,281,vivamus tortor duis mattis egestas metus aenean,Message,0,2/21/24
282,727,274,metus vitae ipsum aliquam non mauris morbi non lectus aliquam,Message,0,2/1/24
283,822,100,vestibulum ac est lacinia nisi venenatis tristique fusce congue diam,Message,1,2/15/24
284,279,920,rutrum ac lobortis vel dapibus at,Message,1,2/19/24
285,509,531,ante vestibulum ante ipsum primis in faucibus orci,Message,1,2/15/24
286,310,860,id ligula suspendisse ornare consequat lectus,Message,1,2/17/24
287,725,77,erat fermentum justo nec condimentum neque sapien placerat,Message,1,2/6/24
288,862,778,vestibulum ante ipsum primis in,Message,1,2/8/24
289,277,529,aliquam erat volutpat in congue,Message,1,2/10/24
290,594,115,a nibh in quis justo maecenas rhoncus aliquam,Message,1,2/23/24
291,195,100,posuere metus vitae ipsum aliquam non,Message,1,2/14/24
292,240,957,placerat ante nulla justo aliquam quis turpis,Message,0,2/11/24
293,762,170,curae mauris viverra diam vitae quam suspendisse potenti nullam porttitor,Message,1,2/19/24
294,638,835,suscipit nulla elit ac nulla sed vel enim,Message,1,2/4/24
295,27,939,platea dictumst aliquam augue quam sollicitudin vitae consectetuer eget rutrum,Message,0,2/13/24
296,721,488,morbi non quam nec dui luctus,Message,1,2/15/24
297,800,905,aliquet pulvinar sed nisl nunc rhoncus dui,Message,0,2/12/24
298,393,74,sit amet justo morbi ut odio cras mi,Message,0,2/16/24
299,274,178,in ante vestibulum ante ipsum primis in faucibus orci,Message,1,2/17/24
300,109,641,mollis molestie lorem quisque ut erat,Message,0,2/2/24
301,866,207,ac enim in tempor turpis nec euismod scelerisque quam turpis,Message,0,2/9/24
302,405,76,nulla pede ullamcorper augue a,Message,1,2/12/24
303,113,97,sed vel enim sit amet nunc viverra,Message,1,2/13/24
304,850,877,suscipit nulla elit ac nulla sed,Message,0,2/12/24
305,835,953,rutrum neque aenean auctor gravida sem praesent id massa,Message,1,2/20/24
306,136,41,diam id ornare imperdiet sapien urna pretium nisl ut volutpat,Message,0,2/22/24
307,609,52,condimentum curabitur in libero ut massa volutpat convallis morbi,Message,0,2/13/24
308,178,394,pede posuere nonummy integer non velit,Message,1,2/24/24
309,670,862,tempus vivamus in felis eu sapien cursus vestibulum,Message,0,2/9/24
310,165,254,vestibulum ante ipsum primis in faucibus orci luctus,Message,0,2/14/24
311,578,833,vel nulla eget eros elementum pellentesque quisque porta,Message,0,2/23/24
312,183,342,viverra diam vitae quam suspendisse potenti nullam porttitor,Message,0,2/17/24
313,479,200,posuere metus vitae ipsum aliquam non mauris morbi non lectus,Message,0,2/13/24
314,574,370,eleifend luctus ultricies eu nibh quisque id justo sit amet,Message,0,2/1/24
315,233,622,justo sollicitudin ut suscipit a feugiat et,Message,1,2/4/24
316,592,159,cum sociis natoque penatibus et magnis dis parturient montes nascetur,Message,1,2/12/24
317,906,969,consequat ut nulla sed accumsan felis ut,Message,0,2/25/24
318,374,409,vitae quam suspendisse potenti nullam porttitor lacus,Message,1,2/19/24
319,683,231,habitasse platea dictumst morbi vestibulum velit id pretium iaculis,Message,1,2/24/24
320,223,296,sed augue aliquam erat volutpat,Message,0,2/8/24
321,849,884,quam pede lobortis ligula sit amet eleifend pede,Message,1,2/8/24
322,774,741,consequat metus sapien ut nunc vestibulum,Message,1,2/21/24
323,330,124,donec odio justo sollicitudin ut suscipit,Message,1,2/22/24
324,849,30,est lacinia nisi venenatis tristique fusce congue diam id,Message,1,2/12/24
325,896,562,turpis elementum ligula vehicula consequat morbi,Message,1,2/6/24
326,570,394,nulla dapibus dolor vel est donec,Message,0,2/11/24
327,454,956,tincidunt nulla mollis molestie lorem quisque ut,Message,0,2/10/24
328,266,576,ornare imperdiet sapien urna pretium nisl ut volutpat sapien arcu,Message,1,2/6/24
329,696,793,nunc purus phasellus in felis donec semper,Message,1,2/6/24
330,166,335,nisi nam ultrices libero non mattis pulvinar nulla,Message,1,2/19/24
