Post_id,User_id,Recipient_id,Content,Type_is,Visible,Created_at
1329,248,,purus sit amet nulla quisque arcu libero rutrum,Story,0,2/4/24
1330,294,,ligula in lacus curabitur at ipsum,Story,0,2/18/24
1331,759,,amet lobortis sapien sapien non mi integer ac,Story,0,2/20/24
1332,437,,nullam molestie nibh in lectus pellentesque at nulla,Story,1,2/16/24
1333,276,,quis justo maecenas rhoncus aliquam lacus,Story,1,2/24/24
1334,822,,fusce consequat nulla nisl nunc,Story,0,2/8/24
1335,407,,eros suspendisse accumsan tortor quis,Story,1,2/4/24
1336,332,,id justo sit amet sapien dignissim,Story,0,2/1/24
1337,24,,nam dui proin leo odio,Story,1,2/19/24
1338,566,,cursus id turpis integer aliquet massa id,Story,1,2/14/24
1339,837,,posuere cubilia curae donec pharetra magna,Story,1,2/8/24
1340,975,,purus sit amet nulla quisque arcu,Story,1,2/19/24
1341,658,,posuere felis sed lacus morbi sem mauris laoreet,Story,0,2/15/24
1342,485,,porta volutpat quam pede lobortis ligula,Story,0,2/3/24
1343,570,,maecenas tristique est et tempus semper est quam pharetra magna,Story,0,2/23/24
1344,934,,nulla ultrices aliquet maecenas leo odio condimentum id,Story,1,2/10/24
1345,527,,aliquam erat volutpat in congue,Story,1,2/18/24
1346,109,,quam pharetra magna ac consequat,Story,1,2/2/24
1347,375,,ante nulla justo aliquam quis,Story,0,2/3/24
1348,720,,sagittis nam congue risus semper,Story,0,2/8/24
1349,229,,eu interdum eu tincidunt in leo maecenas pulvinar lobortis est,Story,0,2/20/24
1350,747,,sed sagittis nam congue risus semper porta volutpat,Story,0,2/14/24
1351,371,,elementum eu interdum eu tincidunt in leo,Story,0,2/16/24
1352,462,,semper rutrum nulla nunc purus phasellus,Story,0,2/1/24
1353,742,,pellentesque volutpat dui maecenas tristique est et tempus semper,Story,0,2/13/24
1354,331,,felis sed lacus morbi sem,Story,1,2/25/24
1355,426,,mi sit amet lobortis sapien sapien non,Story,1,2/13/24
1356,909,,mi nulla ac enim in tempor turpis,Story,0,2/25/24
1357,845,,ut odio cras mi pede,Story,0,2/6/24
1358,77,,metus vitae ipsum aliquam non mauris morbi non,Story,0,2/17/24
1359,785,,nisi at nibh in hac habitasse platea,Story,0,2/16/24
1360,124,,et ultrices posuere cubilia curae donec pharetra magna vestibulum aliquet,Story,1,2/13/24
1361,285,,gravida nisi at nibh in hac,Story,0,2/11/24
1362,772,,est et tempus semper est quam pharetra magna ac consequat,Story,0,2/21/24
1363,273,,ligula pellentesque ultrices phasellus id sapien in sapien,Story,1,2/11/24
1364,172,,sapien quis libero nullam sit amet turpis elementum ligula,Story,0,2/10/24
1365,740,,donec diam neque vestibulum eget vulputate,Story,1,2/12/24
1366,27,,primis in faucibus orci luctus et ultrices posuere,Story,0,2/1/24
1367,762,,aliquam erat volutpat in congue etiam justo etiam pretium iaculis,Story,1,2/4/24
1368,639,,augue a suscipit nulla elit ac,Story,0,2/12/24
1369,746,,nec condimentum neque sapien placerat ante,Story,1,2/5/24
1370,237,,ultrices erat tortor sollicitudin mi sit,Story,0,2/4/24
1371,736,,proin interdum mauris non ligula pellentesque ultrices phasellus,Story,0,2/16/24
1372,696,,turpis nec euismod scelerisque quam turpis adipiscing,Story,1,2/5/24
1373,490,,nam ultrices libero non mattis pulvinar,Story,0,2/15/24
1374,603,,volutpat dui maecenas tristique est et,Story,1,2/21/24
1375,717,,integer pede justo lacinia eget tincidunt eget tempus vel pede,Story,0,2/2/24
1376,182,,dolor morbi vel lectus in,Story,1,2/13/24
1377,169,,augue aliquam erat volutpat in congue etiam justo etiam,Story,1,2/13/24
1378,508,,est congue elementum in hac habitasse platea dictumst morbi vestibulum,Story,0,2/24/24
1379,169,,in tempor turpis nec euismod,Story,0,2/19/24
1380,212,,ultrices posuere cubilia curae nulla dapibus dolor,Story,0,2/11/24
1381,558,,accumsan odio curabitur convallis duis,Story,1,2/21/24
1382,967,,vestibulum rutrum rutrum neque aenean auctor gravida sem praesent,Story,1,2/6/24
1383,493,,felis fusce posuere felis sed,Story,1,2/24/24
1384,93,,pellentesque volutpat dui maecenas tristique est,Story,0,2/7/24
1385,855,,sapien cursus vestibulum proin eu,Story,1,2/1/24
1386,632,,morbi ut odio cras mi pede malesuada in imperdiet,Story,1,2/13/24
1387,293,,eu mi nulla ac enim in,Story,0,2/9/24
1388,497,,sagittis sapien cum sociis natoque penatibus et magnis,Story,0,2/22/24
1389,664,,diam vitae quam suspendisse potenti nullam porttitor,Story,1,2/12/24
1390,827,,et tempus semper est quam pharetra,Story,0,2/6/24
1391,571,,aliquet at feugiat non pretium quis,Story,0,2/2/24
1392,585,,pede ullamcorper augue a suscipit nulla elit,Story,1,2/24/24
1393,867,,nulla ut erat id mauris vulputate elementum nullam varius,Story,0,2/11/24
1394,364,,ac consequat metus sapien ut nunc vestibulum ante,Story,0,2/2/24
1395,548,,sapien cum sociis natoque penatibus et,Story,0,2/10/24
1396,142,,mauris eget massa tempor convallis nulla neque libero,Story,1,2/3/24
1397,103,,maecenas tincidunt lacus at velit vivamus vel nulla eget,Story,0,2/23/24
1398,830,,eget elit sodales scelerisque mauris,Story,0,2/10/24
1399,443,,orci pede venenatis non sodales sed tincidunt eu felis fusce,Story,0,2/9/24
1400,569,,orci mauris lacinia sapien quis libero nullam sit amet,Story,1,2/14/24
1401,455,,erat vestibulum sed magna at nunc commodo placerat,Story,1,2/18/24
1402,455,,lacus morbi quis tortor id nulla ultrices aliquet maecenas,Story,1,2/18/24
1403,94,,fermentum donec ut mauris eget massa tempor,Story,1,2/25/24
1404,812,,primis in faucibus orci luctus et ultrices posuere cubilia,Story,0,2/20/24
1405,659,,dolor sit amet consectetuer adipiscing elit proin,Story,0,2/8/24
1406,432,,vestibulum eget vulputate ut ultrices,Story,0,2/7/24
1407,216,,amet justo morbi ut odio,Story,1,2/14/24
1408,755,,sapien varius ut blandit non interdum in ante,Story,1,2/9/24
1409,923,,bibendum imperdiet nullam orci pede,Story,0,2/4/24
1410,430,,pellentesque viverra pede ac diam cras pellentesque volutpat dui maecenas,Story,1,2/23/24
1411,827,,pretium iaculis justo in hac habitasse platea dictumst,Story,1,2/3/24
1412,571,,semper sapien a libero nam,Story,1,2/16/24
1413,971,,mattis pulvinar nulla pede ullamcorper,Story,1,2/20/24
1414,975,,risus auctor sed tristique in tempus sit amet sem fusce,Story,0,2/17/24
1415,278,,consequat metus sapien ut nunc vestibulum ante,Story,0,2/9/24
1416,552,,nulla sed accumsan felis ut,Story,0,2/16/24
1417,284,,mauris morbi non lectus aliquam sit amet diam in magna,Story,0,2/7/24
1418,666,,vitae consectetuer eget rutrum at lorem,Story,1,2/22/24
1419,682,,id nulla ultrices aliquet maecenas leo,Story,1,2/11/24
1420,831,,non pretium quis lectus suspendisse potenti in eleifend,Story,1,2/2/24
1421,808,,mi sit amet lobortis sapien sapien non mi integer ac,Story,1,2/7/24
1422,63,,cursus vestibulum proin eu mi nulla ac enim in,Story,1,2/7/24
1423,773,,a pede posuere nonummy integer non velit donec diam,Story,0,2/7/24
1424,758,,metus arcu adipiscing molestie hendrerit at vulputate,Story,1,2/16/24
1425,414,,turpis nec euismod scelerisque quam turpis,Story,1,2/17/24
1426,195,,porttitor lorem id ligula suspendisse ornare consequat lectus in,Story,0,2/17/24
1427,171,,vivamus metus arcu adipiscing molestie hendrerit at,Story,1,2/9/24
1428,304,,iaculis congue vivamus metus arcu adipiscing molestie hendrerit at,Story,1,2/20/24
1429,31,,volutpat dui maecenas tristique est et tempus semper est,Story,0,2/4/24
1430,78,,nisl nunc nisl duis bibendum felis sed,Story,1,2/17/24
1431,43,,sapien dignissim vestibulum vestibulum ante ipsum primis in faucibus,Story,0,2/25/24
1432,245,,libero quis orci nullam molestie nibh in,Story,1,2/6/24
1433,790,,habitasse platea dictumst morbi vestibulum velit id pretium,Story,0,2/20/24
1434,2,,tincidunt eu felis fusce posuere,Story,1,2/17/24
1435,966,,leo maecenas pulvinar lobortis est phasellus sit,Story,0,2/23/24
1436,447,,et magnis dis parturient montes nascetur ridiculus mus vivamus,Story,0,2/22/24
1437,592,,lacus purus aliquet at feugiat non,Story,0,2/9/24
1438,633,,elit proin risus praesent lectus vestibulum quam,Story,0,2/9/24
1439,784,,vestibulum vestibulum ante ipsum primis in,Story,0,2/16/24
1440,781,,dui nec nisi volutpat eleifend,Story,1,2/3/24
1441,661,,auctor sed tristique in tempus sit amet sem,Story,1,2/13/24
1442,853,,amet diam in magna bibendum imperdiet nullam orci,Story,1,2/13/24
1443,370,,nec dui luctus rutrum nulla tellus,Story,0,2/20/24
1444,332,,fermentum justo nec condimentum neque sapien placerat ante nulla,Story,0,2/5/24
1445,585,,in porttitor pede justo eu massa,Story,1,2/25/24
1446,327,,et ultrices posuere cubilia curae nulla dapibus dolor vel est,Story,0,2/8/24
1447,883,,porttitor lorem id ligula suspendisse ornare consequat lectus,Story,0,2/3/24
1448,914,,volutpat eleifend donec ut dolor morbi vel lectus in quam,Story,1,2/6/24
1449,132,,molestie hendrerit at vulputate vitae nisl aenean lectus,Story,0,2/8/24
1450,881,,vel augue vestibulum rutrum rutrum neque aenean auctor gravida,Story,0,2/18/24
1451,347,,sapien iaculis congue vivamus metus arcu adipiscing molestie,Story,1,2/13/24
1452,258,,ipsum aliquam non mauris morbi,Story,0,2/21/24
1453,499,,praesent id massa id nisl venenatis lacinia aenean sit amet,Story,1,2/17/24
1454,898,,quam pharetra magna ac consequat,Story,1,2/19/24
1455,318,,a nibh in quis justo maecenas,Story,0,2/1/24
1456,319,,vestibulum proin eu mi nulla,Story,0,2/5/24
1457,398,,vestibulum ante ipsum primis in faucibus,Story,0,2/9/24
1458,987,,ullamcorper augue a suscipit nulla elit ac nulla sed vel,Story,1,2/5/24
1459,973,,accumsan tellus nisi eu orci,Story,0,2/10/24
1460,220,,massa donec dapibus duis at velit,Story,1,2/10/24
1461,187,,justo in hac habitasse platea dictumst,Story,0,2/22/24
1462,444,,dolor vel est donec odio justo sollicitudin ut,Story,1,2/12/24
1463,819,,nec nisi volutpat eleifend donec ut dolor morbi vel,Story,0,2/6/24
1464,572,,posuere nonummy integer non velit donec diam,Story,1,2/2/24
1465,31,,mauris lacinia sapien quis libero,Story,0,2/6/24
1466,256,,aliquet massa id lobortis convallis,Story,0,2/9/24
1467,153,,faucibus orci luctus et ultrices posuere,Story,0,2/23/24
1468,743,,posuere cubilia curae duis faucibus accumsan odio curabitur,Story,0,2/4/24
1469,401,,faucibus accumsan odio curabitur convallis duis consequat dui nec,Story,1,2/6/24
1470,573,,aliquam sit amet diam in magna,Story,0,2/22/24
1471,812,,morbi sem mauris laoreet ut,Story,0,2/11/24
1472,164,,pellentesque viverra pede ac diam,Story,1,2/25/24
1473,243,,rhoncus aliquam lacus morbi quis tortor id nulla ultrices aliquet,Story,1,2/4/24
1474,537,,mus vivamus vestibulum sagittis sapien cum,Story,0,2/12/24
1475,812,,condimentum neque sapien placerat ante nulla justo aliquam quis,Story,0,2/6/24
1476,737,,pretium iaculis diam erat fermentum justo nec condimentum,Story,1,2/18/24
1477,282,,curae mauris viverra diam vitae,Story,0,2/18/24
1478,449,,morbi porttitor lorem id ligula suspendisse ornare consequat lectus,Story,0,2/2/24
1479,653,,in tempor turpis nec euismod scelerisque quam turpis,Story,0,2/10/24
1480,829,,nisi at nibh in hac,Story,0,2/8/24
1481,200,,est et tempus semper est quam pharetra magna ac,Story,1,2/2/24
1482,797,,neque duis bibendum morbi non quam nec,Story,0,2/8/24
1483,342,,amet nunc viverra dapibus nulla suscipit ligula in,Story,1,2/2/24
1484,170,,faucibus orci luctus et ultrices posuere cubilia,Story,1,2/17/24
1485,587,,at nibh in hac habitasse,Story,0,2/16/24
1486,831,,mauris viverra diam vitae quam suspendisse potenti nullam porttitor,Story,0,2/16/24
1487,62,,pede venenatis non sodales sed tincidunt eu felis,Story,0,2/14/24
1488,992,,sapien cum sociis natoque penatibus,Story,0,2/9/24
1489,771,,magnis dis parturient montes nascetur ridiculus mus vivamus vestibulum,Story,0,2/7/24
1490,172,,proin risus praesent lectus vestibulum quam sapien varius ut blandit,Story,0,2/10/24
1491,718,,rhoncus aliquet pulvinar sed nisl nunc rhoncus,Story,0,2/10/24
1492,365,,eget elit sodales scelerisque mauris sit amet eros,Story,0,2/12/24
1493,855,,sit amet nulla quisque arcu libero rutrum ac lobortis vel,Story,1,2/9/24
1494,955,,elementum eu interdum eu tincidunt in leo maecenas,Story,1,2/6/24
1495,108,,in est risus auctor sed tristique in tempus sit,Story,1,2/6/24
1496,631,,non interdum in ante vestibulum,Story,1,2/17/24
1497,16,,at feugiat non pretium quis lectus suspendisse potenti in,Story,0,2/17/24
1498,643,,posuere cubilia curae mauris viverra diam vitae quam,Story,1,2/23/24
1499,506,,in hac habitasse platea dictumst aliquam,Story,1,2/9/24
1500,568,,non lectus aliquam sit amet diam in magna bibendum imperdiet,Story,1,2/6/24
1501,935,,sed accumsan felis ut at dolor,Story,1,2/4/24
1502,126,,orci pede venenatis non sodales sed tincidunt,Story,1,2/16/24
1503,607,,erat id mauris vulputate elementum nullam,Story,1,2/5/24
1504,628,,vitae nisi nam ultrices libero non mattis,Story,0,2/17/24
1505,349,,eu tincidunt in leo maecenas pulvinar lobortis est,Story,0,2/5/24
1506,49,,mollis molestie lorem quisque ut erat curabitur gravida,Story,1,2/24/24
1507,704,,vivamus vestibulum sagittis sapien cum sociis natoque penatibus et magnis,Story,1,2/1/24
1508,449,,id justo sit amet sapien dignissim vestibulum vestibulum,Story,1,2/4/24
1509,813,,pede ac diam cras pellentesque volutpat,Story,1,2/24/24
1510,626,,ullamcorper augue a suscipit nulla elit ac nulla,Story,0,2/9/24
1511,342,,pede ullamcorper augue a suscipit nulla elit,Story,1,2/9/24
1512,757,,lobortis ligula sit amet eleifend pede,Story,1,2/8/24
1513,507,,cras in purus eu magna vulputate luctus cum sociis natoque,Story,1,2/19/24
1514,508,,sit amet consectetuer adipiscing elit proin interdum mauris,Story,0,2/23/24
1515,691,,purus aliquet at feugiat non pretium quis,Story,1,2/12/24
1516,541,,semper interdum mauris ullamcorper purus,Story,1,2/2/24
1517,908,,blandit lacinia erat vestibulum sed magna at,Story,1,2/23/24
1518,891,,pulvinar lobortis est phasellus sit amet erat nulla tempus vivamus,Story,1,2/1/24
1519,933,,duis aliquam convallis nunc proin at turpis a pede posuere,Story,0,2/19/24
1520,355,,feugiat et eros vestibulum ac est lacinia nisi,Story,1,2/6/24
1521,953,,purus eu magna vulputate luctus cum,Story,0,2/19/24
1522,928,,integer ac leo pellentesque ultrices mattis odio donec,Story,1,2/1/24
1523,480,,ante ipsum primis in faucibus,Story,0,2/1/24
1524,524,,bibendum felis sed interdum venenatis turpis enim,Story,0,2/6/24
1525,332,,vulputate ut ultrices vel augue vestibulum ante ipsum primis in,Story,0,2/23/24
1526,111,,duis mattis egestas metus aenean fermentum donec ut mauris eget,Story,1,2/18/24
1527,386,,eu sapien cursus vestibulum proin eu,Story,0,2/19/24
1528,779,,eu sapien cursus vestibulum proin,Story,0,2/25/24
1529,22,,et tempus semper est quam pharetra magna ac,Story,1,2/16/24
1530,474,,est quam pharetra magna ac consequat metus sapien,Story,1,2/22/24
1531,898,,aliquam augue quam sollicitudin vitae,Story,0,2/2/24
1532,566,,aliquam augue quam sollicitudin vitae consectetuer eget rutrum at,Story,1,2/2/24
1533,374,,suspendisse accumsan tortor quis turpis sed ante,Story,1,2/17/24
1534,310,,non pretium quis lectus suspendisse potenti in eleifend,Story,1,2/21/24
1535,145,,cum sociis natoque penatibus et magnis,Story,0,2/12/24
1536,172,,felis donec semper sapien a libero nam,Story,1,2/9/24
1537,22,,vel enim sit amet nunc viverra dapibus,Story,0,2/6/24
1538,792,,augue aliquam erat volutpat in congue etiam,Story,0,2/14/24
1539,413,,non sodales sed tincidunt eu felis fusce posuere felis,Story,1,2/13/24
1540,726,,nam nulla integer pede justo lacinia eget tincidunt eget,Story,0,2/10/24
1541,751,,elit sodales scelerisque mauris sit amet eros,Story,0,2/6/24
1542,812,,id justo sit amet sapien dignissim vestibulum vestibulum ante ipsum,Story,1,2/8/24
1543,876,,nibh ligula nec sem duis aliquam convallis,Story,1,2/6/24
1544,500,,nisl nunc nisl duis bibendum felis sed interdum,Story,0,2/12/24
1545,398,,vel ipsum praesent blandit lacinia erat vestibulum sed magna,Story,1,2/11/24
1546,931,,dapibus dolor vel est donec,Story,1,2/3/24
1547,404,,nulla quisque arcu libero rutrum ac,Story,0,2/23/24
1548,184,,in felis eu sapien cursus vestibulum proin eu mi nulla,Story,0,2/25/24
1549,738,,congue elementum in hac habitasse platea dictumst,Story,0,2/15/24
1550,22,,eget rutrum at lorem integer tincidunt ante,Story,1,2/3/24
1551,144,,lobortis est phasellus sit amet erat,Story,0,2/5/24
1552,343,,in tempor turpis nec euismod scelerisque quam turpis adipiscing,Story,0,2/25/24
1553,353,,ut nulla sed accumsan felis ut at dolor,Story,1,2/12/24
1554,22,,pede justo eu massa donec,Story,0,2/15/24
1555,447,,sociis natoque penatibus et magnis,Story,1,2/4/24
1556,499,,purus aliquet at feugiat non pretium quis lectus,Story,1,2/13/24
1557,79,,suspendisse ornare consequat lectus in,Story,1,2/9/24
1558,608,,dolor sit amet consectetuer adipiscing elit proin,Story,1,2/16/24
1559,328,,in imperdiet et commodo vulputate justo in blandit ultrices enim,Story,1,2/5/24
1560,825,,eu interdum eu tincidunt in leo maecenas,Story,1,2/13/24
1561,14,,tellus nisi eu orci mauris lacinia,Story,1,2/3/24
1562,379,,sem fusce consequat nulla nisl nunc nisl duis,Story,1,2/12/24
1563,354,,tempus vel pede morbi porttitor lorem id ligula,Story,1,2/16/24
1564,52,,vivamus metus arcu adipiscing molestie hendrerit at vulputate,Story,0,2/7/24
1565,654,,ullamcorper augue a suscipit nulla elit ac nulla,Story,1,2/2/24
1566,661,,ut massa quis augue luctus tincidunt nulla,Story,1,2/17/24
1567,244,,libero non mattis pulvinar nulla pede ullamcorper augue a,Story,0,2/7/24
1568,352,,in consequat ut nulla sed accumsan felis,Story,0,2/25/24
1569,40,,quisque porta volutpat erat quisque erat eros,Story,1,2/10/24
1570,488,,ut odio cras mi pede malesuada in imperdiet,Story,1,2/13/24
1571,49,,mauris eget massa tempor convallis,Story,0,2/12/24
1572,893,,montes nascetur ridiculus mus etiam vel augue vestibulum rutrum,Story,0,2/17/24
1573,512,,massa quis augue luctus tincidunt nulla mollis,Story,1,2/19/24
1574,128,,quam a odio in hac,Story,0,2/17/24
1575,772,,nisi nam ultrices libero non mattis pulvinar nulla,Story,1,2/4/24
1576,78,,faucibus orci luctus et ultrices posuere cubilia curae,Story,0,2/18/24
1577,917,,felis fusce posuere felis sed lacus morbi sem mauris,Story,1,2/3/24
1578,403,,donec ut dolor morbi vel,Story,0,2/14/24
1579,526,,vivamus vestibulum sagittis sapien cum,Story,0,2/10/24
1580,671,,volutpat eleifend donec ut dolor morbi,Story,0,2/1/24
1581,791,,nulla ac enim in tempor,Story,0,2/14/24
1582,426,,in eleifend quam a odio in hac habitasse,Story,1,2/5/24
1583,563,,turpis eget elit sodales scelerisque mauris sit amet,Story,0,2/6/24
1584,88,,natoque penatibus et magnis dis parturient,Story,1,2/3/24
1585,273,,praesent lectus vestibulum quam sapien varius ut blandit,Story,0,2/4/24
1586,445,,pretium quis lectus suspendisse potenti,Story,0,2/18/24
1587,356,,amet nulla quisque arcu libero rutrum ac lobortis vel,Story,1,2/20/24
1588,201,,justo morbi ut odio cras mi pede malesuada in,Story,0,2/13/24
1589,963,,nulla sed accumsan felis ut at dolor,Story,1,2/22/24
1590,548,,suscipit nulla elit ac nulla sed vel enim,Story,1,2/24/24
1591,758,,sapien urna pretium nisl ut volutpat sapien,Story,1,2/5/24
1592,797,,vel augue vestibulum rutrum rutrum neque aenean auctor gravida sem,Story,1,2/24/24
1593,182,,ridiculus mus etiam vel augue vestibulum,Story,1,2/15/24
1594,954,,metus sapien ut nunc vestibulum ante ipsum primis,Story,0,2/5/24
1595,261,,venenatis non sodales sed tincidunt eu felis fusce,Story,1,2/1/24
1596,132,,sapien iaculis congue vivamus metus arcu adipiscing molestie hendrerit,Story,1,2/10/24
1597,409,,lectus in quam fringilla rhoncus mauris enim leo rhoncus sed,Story,0,2/7/24
1598,588,,accumsan tortor quis turpis sed ante,Story,1,2/3/24
1599,597,,vestibulum sagittis sapien cum sociis natoque penatibus,Story,0,2/19/24
1600,368,,eros elementum pellentesque quisque porta,Story,0,2/21/24
1601,47,,gravida nisi at nibh in hac habitasse,Story,0,2/9/24
1602,351,,libero nam dui proin leo odio porttitor id consequat in,Story,1,2/8/24
1603,522,,dui maecenas tristique est et tempus,Story,1,2/2/24
1604,698,,mauris non ligula pellentesque ultrices,Story,0,2/24/24
1605,578,,nec euismod scelerisque quam turpis adipiscing lorem,Story,0,2/18/24
1606,744,,sem mauris laoreet ut rhoncus aliquet pulvinar,Story,0,2/1/24
1607,447,,nulla tempus vivamus in felis eu sapien cursus vestibulum,Story,0,2/7/24
1608,70,,pretium quis lectus suspendisse potenti in eleifend quam a,Story,0,2/18/24
1609,908,,maecenas leo odio condimentum id luctus nec molestie sed justo,Story,0,2/21/24
1610,441,,non interdum in ante vestibulum ante,Story,0,2/12/24
1611,37,,in eleifend quam a odio,Story,0,2/19/24
1612,997,,aliquam non mauris morbi non,Story,1,2/9/24
1613,470,,sapien iaculis congue vivamus metus,Story,0,2/3/24
1614,2,,magna bibendum imperdiet nullam orci pede venenatis non sodales sed,Story,0,2/11/24
1615,392,,aliquam quis turpis eget elit sodales scelerisque,Story,0,2/19/24
1616,296,,tempus vel pede morbi porttitor,Story,1,2/18/24
1617,163,,dui maecenas tristique est et tempus semper est quam pharetra,Story,0,2/18/24
1618,208,,eget tincidunt eget tempus vel pede,Story,0,2/22/24
1619,28,,pede malesuada in imperdiet et commodo vulputate,Story,1,2/4/24
1620,450,,diam neque vestibulum eget vulputate,Story,0,2/20/24
1621,716,,convallis nunc proin at turpis a pede posuere nonummy,Story,0,2/16/24
1622,226,,quis augue luctus tincidunt nulla mollis molestie lorem quisque,Story,1,2/21/24
1623,106,,tempor convallis nulla neque libero convallis eget eleifend luctus ultricies,Story,0,2/3/24
1624,360,,sit amet consectetuer adipiscing elit,Story,0,2/19/24
1625,319,,in magna bibendum imperdiet nullam orci,Story,0,2/23/24
1626,199,,ornare consequat lectus in est risus,Story,0,2/25/24
1627,883,,tincidunt ante vel ipsum praesent,Story,1,2/1/24
1628,167,,consectetuer eget rutrum at lorem integer tincidunt ante vel ipsum,Story,1,2/9/24
1629,977,,sapien ut nunc vestibulum ante ipsum primis,Story,0,2/5/24
1630,733,,nisl nunc rhoncus dui vel sem sed,Story,1,2/3/24
1631,162,,morbi non lectus aliquam sit amet diam in magna,Story,1,2/6/24
1632,534,,vivamus vestibulum sagittis sapien cum sociis,Story,0,2/16/24
1633,193,,malesuada in imperdiet et commodo vulputate justo in blandit ultrices,Story,1,2/7/24
1634,22,,mattis odio donec vitae nisi nam,Story,1,2/10/24
1635,276,,nulla suscipit ligula in lacus curabitur at ipsum ac,Story,1,2/22/24
1636,607,,rhoncus aliquet pulvinar sed nisl nunc rhoncus dui vel sem,Story,1,2/2/24
1637,657,,adipiscing molestie hendrerit at vulputate vitae nisl,Story,1,2/14/24
1638,389,,molestie hendrerit at vulputate vitae nisl,Story,0,2/20/24
1639,545,,venenatis lacinia aenean sit amet justo morbi ut,Story,0,2/20/24
1640,720,,ipsum primis in faucibus orci luctus et,Story,1,2/21/24
1641,496,,odio odio elementum eu interdum eu tincidunt,Story,0,2/4/24
1642,192,,nisl nunc nisl duis bibendum felis sed interdum,Story,0,2/9/24
1643,30,,in congue etiam justo etiam pretium iaculis justo,Story,1,2/8/24
1644,721,,faucibus cursus urna ut tellus nulla ut,Story,0,2/13/24
1645,906,,placerat praesent blandit nam nulla,Story,1,2/22/24
1646,741,,ullamcorper augue a suscipit nulla elit ac nulla sed vel,Story,0,2/2/24
1647,550,,ante ipsum primis in faucibus orci luctus,Story,1,2/22/24
1648,741,,posuere cubilia curae mauris viverra diam vitae quam suspendisse,Story,1,2/11/24
1649,40,,justo in hac habitasse platea dictumst etiam faucibus,Story,0,2/20/24
1650,135,,morbi non lectus aliquam sit amet diam in magna,Story,1,2/5/24
1651,315,,erat curabitur gravida nisi at,Story,1,2/3/24
1652,456,,est quam pharetra magna ac consequat metus,Story,0,2/5/24
1653,840,,semper sapien a libero nam,Story,0,2/4/24
1654,252,,diam in magna bibendum imperdiet nullam orci pede venenatis,Story,0,2/14/24
1655,112,,nec dui luctus rutrum nulla tellus in sagittis,Story,0,2/12/24
1656,327,,ultrices posuere cubilia curae mauris viverra,Story,1,2/7/24
1657,556,,lacus morbi quis tortor id nulla ultrices aliquet maecenas leo,Story,0,2/2/24
1658,947,,sit amet eleifend pede libero quis,Story,1,2/16/24
1659,243,,imperdiet nullam orci pede venenatis non sodales sed tincidunt eu,Story,0,2/18/24
1660,112,,nonummy integer non velit donec diam neque vestibulum eget,Story,0,2/4/24
1661,165,,ut volutpat sapien arcu sed augue,Story,0,2/12/24
1662,264,,sociis natoque penatibus et magnis dis parturient montes nascetur,Story,1,2/3/24
1663,63,,est congue elementum in hac habitasse platea,Story,1,2/13/24
1664,743,,ullamcorper augue a suscipit nulla,Story,1,2/16/24
1665,429,,convallis duis consequat dui nec nisi volutpat eleifend donec ut,Story,1,2/15/24
1666,538,,curae mauris viverra diam vitae quam suspendisse potenti nullam porttitor,Story,0,2/19/24
1667,747,,ornare imperdiet sapien urna pretium nisl ut volutpat sapien arcu,Story,0,2/10/24
1668,238,,velit donec diam neque vestibulum eget vulputate ut ultrices vel,Story,0,2/9/24
1669,348,,sollicitudin vitae consectetuer eget rutrum at lorem,Story,0,2/7/24
1670,812,,cubilia curae donec pharetra magna,Story,1,2/1/24
1671,408,,quam pharetra magna ac consequat metus sapien ut,Story,0,2/15/24
1672,865,,cras non velit nec nisi vulputate,Story,1,2/15/24
1673,743,,imperdiet nullam orci pede venenatis non sodales sed,Story,1,2/22/24
1674,260,,in eleifend quam a odio in hac,Story,0,2/3/24
1675,995,,nunc proin at turpis a,Story,1,2/15/24
1676,751,,felis sed interdum venenatis turpis enim blandit mi,Story,0,2/24/24
1677,713,,potenti in eleifend quam a odio in hac,Story,1,2/23/24
1678,4,,id turpis integer aliquet massa id lobortis convallis tortor,Story,1,2/16/24
1679,880,,montes nascetur ridiculus mus etiam,Story,1,2/21/24
1680,614,,ultrices vel augue vestibulum ante ipsum primis in faucibus,Story,0,2/22/24
