Post_id,User_id,Recipient_id,Content,Type_is,Visible,Created_at
652,159,45,nec sem duis aliquam convallis nunc proin at turpis a,Message,1,2/3/24
653,480,417,dui maecenas tristique est et tempus semper,Message,1,2/19/24
654,473,360,tincidunt eu felis fusce posuere felis sed,Message,1,2/19/24
655,122,123,sit amet sem fusce consequat nulla,Message,0,2/23/24
656,350,113,elementum nullam varius nulla facilisi cras non velit nec nisi,Message,0,2/19/24
657,334,273,varius integer ac leo pellentesque ultrices mattis odio,Message,1,2/15/24
658,882,15,nascetur ridiculus mus etiam vel augue vestibulum rutrum rutrum neque,Message,0,2/18/24
659,693,132,in faucibus orci luctus et ultrices posuere cubilia curae nulla,Message,1,2/25/24
660,300,253,elementum pellentesque quisque porta volutpat erat quisque erat eros viverra,Message,0,2/11/24
661,441,524,felis fusce posuere felis sed lacus morbi sem mauris laoreet,Message,1,2/21/24
662,796,930,sem duis aliquam convallis nunc,Message,1,2/3/24
663,140,654,pede morbi porttitor lorem id,Message,0,2/16/24
664,581,667,sed vel enim sit amet nunc viverra dapibus,Message,0,2/16/24
665,542,909,at vulputate vitae nisl aenean,Message,0,2/5/24
666,392,59,habitasse platea dictumst etiam faucibus,Message,0,2/22/24
667,745,495,quam pharetra magna ac consequat,Message,1,2/12/24
668,647,841,pretium iaculis diam erat fermentum justo nec,Message,1,2/9/24
669,944,938,cursus urna ut tellus nulla ut erat id,Message,1,2/15/24
670,176,192,mi nulla ac enim in tempor,Message,0,2/21/24
671,240,45,suspendisse potenti in eleifend quam a,Message,0,2/19/24
672,934,79,donec diam neque vestibulum eget,Message,1,2/24/24
673,38,175,curabitur at ipsum ac tellus semper interdum mauris ullamcorper,Message,0,2/22/24
674,558,28,neque sapien placerat ante nulla,Message,0,2/1/24
675,515,335,primis in faucibus orci luctus et ultrices posuere,Message,1,2/23/24
676,859,528,vel sem sed sagittis nam congue risus semper porta,Message,0,2/13/24
677,493,256,ante ipsum primis in faucibus orci luctus et,Message,0,2/21/24
678,838,938,massa donec dapibus duis at velit,Message,1,2/5/24
679,195,281,nulla sed vel enim sit amet nunc viverra dapibus nulla,Message,0,2/16/24
680,548,323,eu interdum eu tincidunt in,Message,1,2/15/24
681,147,996,id consequat in consequat ut nulla,Message,1,2/23/24
682,838,490,porta volutpat quam pede lobortis ligula sit amet eleifend,Message,1,2/1/24
683,827,156,nulla elit ac nulla sed vel,Message,0,2/11/24
684,918,998,vehicula consequat morbi a ipsum integer a nibh in,Message,0,2/3/24
685,970,998,ac nulla sed vel enim sit,Message,0,2/21/24
686,458,404,in felis eu sapien cursus vestibulum,Message,1,2/14/24
687,445,924,ipsum primis in faucibus orci luctus et ultrices,Message,1,2/12/24
688,930,407,sapien quis libero nullam sit,Message,1,2/7/24
689,440,263,viverra dapibus nulla suscipit ligula in lacus curabitur at ipsum,Message,1,2/3/24
690,363,353,fusce consequat nulla nisl nunc nisl duis,Message,1,2/4/24
691,298,206,diam cras pellentesque volutpat dui maecenas tristique est et tempus,Message,0,2/6/24
692,628,152,at turpis a pede posuere nonummy integer non velit,Message,1,2/21/24
693,774,114,at nibh in hac habitasse platea dictumst aliquam augue,Message,1,2/22/24
694,93,488,eget elit sodales scelerisque mauris sit amet eros suspendisse,Message,0,2/24/24
695,400,41,justo pellentesque viverra pede ac,Message,0,2/10/24
696,466,193,duis bibendum morbi non quam nec dui luctus rutrum nulla,Message,1,2/15/24
697,105,301,nibh in quis justo maecenas rhoncus aliquam lacus morbi,Message,1,2/1/24
698,905,137,lorem ipsum dolor sit amet consectetuer,Message,1,2/5/24
699,924,81,nec nisi vulputate nonummy maecenas tincidunt lacus at velit,Message,1,2/13/24
700,734,795,mauris enim leo rhoncus sed vestibulum sit amet cursus,Message,0,2/5/24
701,539,348,tortor quis turpis sed ante vivamus tortor,Message,1,2/2/24
702,487,20,semper interdum mauris ullamcorper purus sit,Message,0,2/23/24
703,993,948,odio odio elementum eu interdum eu tincidunt in leo,Message,1,2/23/24
704,36,161,lobortis est phasellus sit amet erat nulla tempus vivamus,Message,0,2/4/24
705,80,702,tempor convallis nulla neque libero convallis eget eleifend luctus ultricies,Message,1,2/13/24
706,941,984,leo rhoncus sed vestibulum sit amet cursus id,Message,0,2/5/24
707,767,767,bibendum imperdiet nullam orci pede venenatis non sodales,Message,1,2/10/24
708,82,633,interdum eu tincidunt in leo maecenas,Message,0,2/3/24
709,649,172,ut nulla sed accumsan felis ut at dolor quis odio,Message,1,2/1/24
710,441,622,eros suspendisse accumsan tortor quis turpis,Message,0,2/21/24
711,491,3,lacus morbi sem mauris laoreet ut rhoncus,Message,1,2/6/24
712,44,32,consequat lectus in est risus auctor sed,Message,0,2/11/24
713,523,627,vivamus vel nulla eget eros elementum pellentesque quisque porta volutpat,Message,1,2/20/24
714,276,459,pede morbi porttitor lorem id ligula suspendisse ornare,Message,1,2/18/24
715,462,581,semper rutrum nulla nunc purus phasellus in felis,Message,1,2/25/24
716,80,539,sit amet nulla quisque arcu libero rutrum ac lobortis vel,Message,1,2/7/24
717,33,334,risus semper porta volutpat quam pede lobortis ligula,Message,0,2/15/24
718,567,413,ut erat id mauris vulputate,Message,0,2/22/24
719,705,316,a ipsum integer a nibh in quis,Message,0,2/13/24
720,922,561,non quam nec dui luctus rutrum nulla,Message,1,2/8/24
721,133,390,amet erat nulla tempus vivamus in felis eu sapien cursus,Message,0,2/12/24
722,17,774,justo pellentesque viverra pede ac diam cras pellentesque volutpat dui,Message,0,2/6/24
723,278,533,molestie lorem quisque ut erat curabitur gravida,Message,0,2/20/24
724,752,544,sapien arcu sed augue aliquam erat,Message,0,2/15/24
725,643,652,sociis natoque penatibus et magnis dis parturient montes nascetur,Message,0,2/20/24
726,585,176,rhoncus aliquam lacus morbi quis tortor id nulla ultrices aliquet,Message,0,2/10/24
727,285,726,convallis tortor risus dapibus augue vel accumsan tellus nisi eu,Message,0,2/23/24
728,446,765,lorem vitae mattis nibh ligula nec sem,Message,1,2/5/24
729,503,806,vulputate luctus cum sociis natoque penatibus et magnis dis,Message,1,2/20/24
730,549,821,sapien sapien non mi integer,Message,1,2/15/24
731,700,771,enim blandit mi in porttitor,Message,0,2/9/24
732,10,809,potenti cras in purus eu magna,Message,1,2/24/24
733,942,87,lectus aliquam sit amet diam in magna bibendum,Message,1,2/6/24
734,345,805,at velit eu est congue elementum in,Message,0,2/20/24
735,476,611,rutrum at lorem integer tincidunt ante vel ipsum praesent,Message,1,2/20/24
736,740,521,quis lectus suspendisse potenti in eleifend quam,Message,0,2/6/24
737,307,940,id consequat in consequat ut nulla sed,Message,1,2/16/24
738,237,795,potenti in eleifend quam a odio,Message,0,2/13/24
739,105,582,luctus rutrum nulla tellus in sagittis,Message,1,2/19/24
740,246,300,nisl duis bibendum felis sed interdum venenatis,Message,0,2/17/24
741,277,631,a libero nam dui proin leo,Message,0,2/10/24
742,603,330,orci mauris lacinia sapien quis libero nullam sit amet,Message,1,2/4/24
743,478,206,integer a nibh in quis justo maecenas rhoncus aliquam lacus,Message,0,2/3/24
744,904,246,suscipit ligula in lacus curabitur at ipsum ac tellus semper,Message,1,2/22/24
745,421,848,commodo placerat praesent blandit nam,Message,1,2/23/24
746,267,811,odio porttitor id consequat in consequat ut nulla,Message,0,2/16/24
747,336,204,sit amet erat nulla tempus vivamus,Message,0,2/20/24
748,156,971,in faucibus orci luctus et ultrices,Message,0,2/7/24
749,911,162,et eros vestibulum ac est lacinia nisi venenatis tristique fusce,Message,1,2/10/24
750,623,728,in felis donec semper sapien,Message,0,2/4/24
751,781,358,risus dapibus augue vel accumsan tellus nisi eu orci,Message,0,2/10/24
752,487,239,quam pharetra magna ac consequat metus sapien ut nunc vestibulum,Message,1,2/4/24
753,597,83,nunc nisl duis bibendum felis sed interdum venenatis turpis,Message,0,2/15/24
754,807,608,nibh ligula nec sem duis,Message,0,2/12/24
755,895,214,magna ac consequat metus sapien ut,Message,1,2/4/24
756,926,69,nulla tempus vivamus in felis eu,Message,1,2/1/24
757,354,533,tortor duis mattis egestas metus aenean fermentum,Message,1,2/22/24
758,591,584,dapibus augue vel accumsan tellus,Message,0,2/13/24
759,532,447,sem praesent id massa id nisl venenatis,Message,0,2/20/24
760,863,233,ultrices posuere cubilia curae nulla dapibus dolor vel est donec,Message,0,2/2/24
761,524,979,nulla suscipit ligula in lacus,Message,1,2/21/24
762,626,477,eu est congue elementum in hac habitasse platea dictumst morbi,Message,1,2/12/24
763,240,298,dignissim vestibulum vestibulum ante ipsum primis in faucibus orci,Message,0,2/20/24
764,200,938,justo eu massa donec dapibus duis,Message,1,2/7/24
765,402,801,magnis dis parturient montes nascetur ridiculus,Message,0,2/6/24
766,43,361,in blandit ultrices enim lorem ipsum dolor,Message,1,2/10/24
767,658,475,morbi porttitor lorem id ligula suspendisse,Message,0,2/11/24
768,668,901,orci luctus et ultrices posuere cubilia curae,Message,1,2/5/24
769,68,669,in eleifend quam a odio,Message,1,2/16/24
770,682,169,quam pharetra magna ac consequat metus sapien ut,Message,1,2/9/24
771,244,857,felis sed lacus morbi sem mauris laoreet ut rhoncus,Message,1,2/23/24
772,336,521,pellentesque at nulla suspendisse potenti cras in purus eu magna,Message,0,2/15/24
773,81,269,porttitor pede justo eu massa donec dapibus duis at velit,Message,1,2/17/24
774,384,598,ut ultrices vel augue vestibulum ante ipsum,Message,0,2/24/24
775,130,84,ut ultrices vel augue vestibulum ante,Message,0,2/22/24
776,479,489,magna vulputate luctus cum sociis natoque penatibus,Message,1,2/14/24
777,52,445,primis in faucibus orci luctus et ultrices posuere cubilia,Message,1,2/19/24
778,671,590,id sapien in sapien iaculis,Message,1,2/18/24
779,656,222,lorem ipsum dolor sit amet consectetuer,Message,0,2/3/24
780,857,710,duis bibendum felis sed interdum venenatis turpis enim blandit mi,Message,1,2/17/24
781,359,617,vel dapibus at diam nam tristique,Message,0,2/6/24
782,686,129,duis bibendum felis sed interdum venenatis turpis enim,Message,0,2/11/24
783,511,978,eget rutrum at lorem integer tincidunt ante,Message,0,2/4/24
784,958,75,augue a suscipit nulla elit,Message,0,2/5/24
785,983,672,cras pellentesque volutpat dui maecenas tristique est et,Message,1,2/3/24
786,295,538,magna ac consequat metus sapien ut,Message,0,2/20/24
787,905,308,congue eget semper rutrum nulla nunc purus,Message,1,2/3/24
788,28,841,placerat ante nulla justo aliquam quis turpis eget elit sodales,Message,0,2/4/24
789,391,2,turpis a pede posuere nonummy integer non velit donec,Message,1,2/20/24
790,755,268,tortor sollicitudin mi sit amet lobortis sapien,Message,0,2/17/24
791,97,87,natoque penatibus et magnis dis,Message,0,2/6/24
792,244,694,pellentesque volutpat dui maecenas tristique est et tempus semper est,Message,0,2/17/24
793,517,689,convallis tortor risus dapibus augue vel accumsan tellus,Message,0,2/12/24
794,949,816,at velit vivamus vel nulla,Message,1,2/7/24
795,81,559,sollicitudin ut suscipit a feugiat et eros,Message,1,2/19/24
796,361,324,etiam justo etiam pretium iaculis justo,Message,0,2/6/24
797,342,684,amet consectetuer adipiscing elit proin risus praesent lectus,Message,0,2/3/24
798,700,890,luctus nec molestie sed justo,Message,0,2/15/24
799,461,417,nulla eget eros elementum pellentesque quisque porta volutpat,Message,1,2/22/24
800,718,64,viverra diam vitae quam suspendisse potenti nullam,Message,0,2/22/24
801,61,453,curabitur gravida nisi at nibh in,Message,1,2/21/24
802,420,855,ante vivamus tortor duis mattis egestas metus aenean fermentum donec,Message,1,2/15/24
803,925,72,purus phasellus in felis donec semper sapien a libero,Message,1,2/2/24
804,65,339,sagittis dui vel nisl duis ac nibh fusce lacus purus,Message,1,2/10/24
805,672,992,fermentum donec ut mauris eget massa tempor convallis,Message,1,2/2/24
806,709,173,curabitur in libero ut massa volutpat,Message,1,2/20/24
807,238,999,quam sollicitudin vitae consectetuer eget rutrum,Message,0,2/15/24
808,566,30,vestibulum eget vulputate ut ultrices,Message,0,2/25/24
809,731,173,neque aenean auctor gravida sem praesent id massa id nisl,Message,0,2/10/24
810,784,784,libero non mattis pulvinar nulla,Message,0,2/8/24
811,937,260,fusce lacus purus aliquet at feugiat non pretium,Message,1,2/12/24
812,312,917,aliquam augue quam sollicitudin vitae consectetuer eget,Message,1,2/24/24
813,948,4,purus sit amet nulla quisque arcu,Message,0,2/19/24
814,939,45,eget massa tempor convallis nulla,Message,1,2/23/24
815,689,978,ligula suspendisse ornare consequat lectus,Message,0,2/16/24
816,16,20,sapien a libero nam dui proin leo odio porttitor id,Message,1,2/23/24
817,841,387,vestibulum eget vulputate ut ultrices vel augue vestibulum ante,Message,1,2/5/24
818,680,776,orci nullam molestie nibh in lectus,Message,0,2/14/24
819,344,901,odio porttitor id consequat in consequat ut nulla sed,Message,1,2/3/24
820,186,887,eu sapien cursus vestibulum proin eu mi nulla ac,Message,1,2/15/24
821,801,461,tellus in sagittis dui vel nisl,Message,0,2/17/24
822,602,13,ligula vehicula consequat morbi a ipsum integer a nibh,Message,1,2/25/24
823,315,943,consequat varius integer ac leo pellentesque ultrices mattis odio,Message,0,2/17/24
824,643,649,nec euismod scelerisque quam turpis adipiscing,Message,0,2/24/24
825,534,148,leo maecenas pulvinar lobortis est phasellus sit,Message,1,2/9/24
826,826,742,turpis sed ante vivamus tortor duis mattis,Message,1,2/25/24
827,702,136,aliquam quis turpis eget elit sodales scelerisque mauris sit,Message,0,2/10/24
828,105,739,egestas metus aenean fermentum donec ut mauris eget,Message,0,2/2/24
829,396,899,duis mattis egestas metus aenean fermentum,Message,0,2/9/24
830,649,964,donec posuere metus vitae ipsum aliquam non mauris morbi,Message,1,2/7/24
831,751,729,luctus et ultrices posuere cubilia curae mauris viverra,Message,0,2/3/24
832,148,169,quis turpis eget elit sodales,Message,0,2/23/24
833,56,734,varius integer ac leo pellentesque,Message,0,2/22/24
834,433,668,lorem id ligula suspendisse ornare consequat,Message,1,2/5/24
835,228,657,semper rutrum nulla nunc purus phasellus in felis,Message,1,2/14/24
836,972,681,dolor morbi vel lectus in quam fringilla rhoncus,Message,1,2/24/24
837,96,222,curae duis faucibus accumsan odio curabitur,Message,1,2/18/24
838,259,155,orci luctus et ultrices posuere cubilia curae,Message,0,2/16/24
839,76,421,vitae consectetuer eget rutrum at lorem integer tincidunt ante vel,Message,1,2/13/24
840,613,715,potenti nullam porttitor lacus at,Message,0,2/18/24
841,405,227,in blandit ultrices enim lorem ipsum dolor sit,Message,0,2/9/24
842,286,18,pellentesque quisque porta volutpat erat quisque erat eros viverra eget,Message,1,2/16/24
843,622,489,dapibus duis at velit eu est congue elementum in,Message,0,2/16/24
844,197,795,tortor id nulla ultrices aliquet maecenas leo odio,Message,0,2/7/24
845,502,486,posuere cubilia curae duis faucibus accumsan odio curabitur,Message,0,2/25/24
846,53,756,semper sapien a libero nam dui proin leo odio porttitor,Message,0,2/20/24
847,607,887,ultrices enim lorem ipsum dolor sit amet consectetuer adipiscing elit,Message,1,2/4/24
848,424,893,leo maecenas pulvinar lobortis est,Message,0,2/20/24
849,883,412,sodales sed tincidunt eu felis fusce posuere felis sed lacus,Message,1,2/7/24
850,937,995,phasellus sit amet erat nulla tempus vivamus in felis eu,Message,0,2/24/24
851,69,253,nulla elit ac nulla sed vel enim sit,Message,1,2/2/24
852,629,999,quis lectus suspendisse potenti in eleifend quam a,Message,1,2/5/24
853,598,554,fermentum donec ut mauris eget massa tempor convallis nulla neque,Message,1,2/8/24
854,910,313,morbi sem mauris laoreet ut rhoncus aliquet pulvinar sed,Message,1,2/25/24
855,307,101,diam id ornare imperdiet sapien urna pretium,Message,1,2/8/24
856,696,926,mauris laoreet ut rhoncus aliquet,Message,1,2/8/24
857,575,82,elementum in hac habitasse platea dictumst morbi vestibulum,Message,1,2/14/24
858,70,811,porta volutpat erat quisque erat eros viverra eget congue eget,Message,1,2/23/24
859,327,196,aliquam augue quam sollicitudin vitae consectetuer eget,Message,1,2/2/24
860,725,741,porta volutpat quam pede lobortis ligula sit,Message,1,2/13/24
861,136,290,ut rhoncus aliquet pulvinar sed nisl nunc rhoncus dui,Message,0,2/22/24
862,807,157,cubilia curae duis faucibus accumsan odio curabitur,Message,0,2/22/24
863,464,687,praesent blandit nam nulla integer pede justo lacinia eget tincidunt,Message,1,2/23/24
864,105,278,fusce lacus purus aliquet at feugiat non pretium quis lectus,Message,1,2/2/24
865,334,17,luctus et ultrices posuere cubilia curae,Message,0,2/14/24
866,326,460,nullam orci pede venenatis non sodales sed tincidunt eu felis,Message,1,2/4/24
867,317,344,in felis donec semper sapien a libero,Message,1,2/22/24
868,148,873,at turpis donec posuere metus vitae ipsum aliquam,Message,0,2/8/24
869,964,898,aliquam augue quam sollicitudin vitae consectetuer eget rutrum at lorem,Message,0,2/1/24
870,644,236,orci pede venenatis non sodales sed,Message,1,2/17/24
871,326,287,consequat nulla nisl nunc nisl duis bibendum felis,Message,0,2/7/24
872,422,135,quis lectus suspendisse potenti in eleifend,Message,1,2/25/24
873,718,301,fusce congue diam id ornare imperdiet sapien urna,Message,1,2/13/24
874,535,151,orci nullam molestie nibh in lectus pellentesque at,Message,1,2/18/24
875,633,662,sapien ut nunc vestibulum ante,Message,1,2/25/24
876,326,825,velit vivamus vel nulla eget eros elementum,Message,1,2/6/24
877,848,555,id ligula suspendisse ornare consequat lectus in est risus auctor,Message,0,2/25/24
878,26,720,semper interdum mauris ullamcorper purus sit amet nulla quisque,Message,1,2/14/24
879,512,261,vitae quam suspendisse potenti nullam porttitor lacus at turpis donec,Message,0,2/17/24
880,581,625,sapien placerat ante nulla justo aliquam quis turpis eget,Message,0,2/18/24
881,787,322,rhoncus aliquet pulvinar sed nisl,Message,0,2/8/24
882,923,419,eros suspendisse accumsan tortor quis turpis sed ante,Message,0,2/2/24
883,947,659,eu est congue elementum in,Message,0,2/4/24
884,137,599,maecenas tristique est et tempus semper est quam pharetra magna,Message,0,2/6/24
885,50,531,tincidunt eu felis fusce posuere felis sed lacus morbi,Message,1,2/3/24
886,647,17,amet sapien dignissim vestibulum vestibulum ante ipsum primis in,Message,0,2/2/24
887,204,997,ipsum aliquam non mauris morbi non,Message,0,2/10/24
888,745,235,amet eleifend pede libero quis orci,Message,0,2/22/24
889,891,786,proin interdum mauris non ligula pellentesque ultrices phasellus id,Message,0,2/4/24
890,59,84,quam sapien varius ut blandit non,Message,1,2/9/24
891,796,829,fusce posuere felis sed lacus,Message,1,2/7/24
892,325,799,mus etiam vel augue vestibulum rutrum rutrum neque,Message,1,2/23/24
893,449,744,elit proin interdum mauris non ligula pellentesque ultrices phasellus id,Message,0,2/12/24
894,507,829,in hac habitasse platea dictumst morbi vestibulum velit id pretium,Message,1,2/25/24
895,961,21,tortor sollicitudin mi sit amet lobortis sapien,Message,1,2/21/24
896,346,853,vel augue vestibulum rutrum rutrum neque aenean auctor,Message,1,2/7/24
897,856,428,vestibulum eget vulputate ut ultrices vel augue vestibulum,Message,1,2/18/24
898,113,143,faucibus orci luctus et ultrices posuere cubilia,Message,1,2/13/24
899,220,989,a suscipit nulla elit ac,Message,0,2/21/24
900,983,403,sagittis nam congue risus semper porta volutpat quam pede,Message,0,2/22/24
901,481,385,accumsan tellus nisi eu orci mauris lacinia sapien quis,Message,1,2/18/24
902,268,559,turpis eget elit sodales scelerisque mauris,Message,1,2/12/24
903,160,142,sem duis aliquam convallis nunc proin at turpis,Message,1,2/25/24
904,342,851,in faucibus orci luctus et,Message,0,2/18/24
905,581,489,platea dictumst maecenas ut massa,Message,1,2/8/24
906,410,255,tincidunt lacus at velit vivamus,Message,0,2/2/24
907,737,403,consequat ut nulla sed accumsan felis ut at dolor,Message,1,2/20/24
908,669,720,in imperdiet et commodo vulputate justo,Message,0,2/7/24
909,124,438,at feugiat non pretium quis lectus suspendisse potenti in,Message,0,2/13/24
910,163,611,vestibulum sit amet cursus id,Message,0,2/14/24
911,40,608,mattis egestas metus aenean fermentum donec ut mauris eget massa,Message,0,2/14/24
912,395,773,adipiscing elit proin risus praesent lectus vestibulum,Message,1,2/20/24
913,136,275,curabitur at ipsum ac tellus,Message,0,2/23/24
914,504,960,scelerisque quam turpis adipiscing lorem vitae mattis nibh ligula nec,Message,0,2/13/24
915,517,972,convallis nulla neque libero convallis eget eleifend,Message,1,2/17/24
916,427,375,vivamus in felis eu sapien cursus vestibulum proin eu mi,Message,1,2/15/24
917,578,142,eget vulputate ut ultrices vel augue,Message,1,2/10/24
918,928,884,ligula in lacus curabitur at ipsum,Message,0,2/13/24
919,33,223,sit amet consectetuer adipiscing elit proin risus praesent lectus,Message,1,2/4/24
920,489,836,velit eu est congue elementum in hac habitasse platea dictumst,Message,0,2/11/24
921,394,943,dolor quis odio consequat varius integer,Message,1,2/16/24
922,353,663,cum sociis natoque penatibus et magnis,Message,1,2/11/24
923,536,187,maecenas pulvinar lobortis est phasellus,Message,1,2/18/24
924,842,599,vulputate luctus cum sociis natoque,Message,1,2/3/24
925,511,621,viverra pede ac diam cras pellentesque,Message,1,2/21/24
926,670,610,in faucibus orci luctus et ultrices posuere cubilia curae,Message,0,2/24/24
927,397,285,interdum mauris non ligula pellentesque ultrices phasellus id,Message,1,2/11/24
928,409,313,cras pellentesque volutpat dui maecenas tristique est et,Message,1,2/20/24
929,572,211,nec dui luctus rutrum nulla tellus in sagittis,Message,0,2/20/24
930,577,790,tempus vel pede morbi porttitor lorem,Message,0,2/5/24
931,718,120,donec diam neque vestibulum eget vulputate ut ultrices,Message,0,2/14/24
932,211,699,orci luctus et ultrices posuere cubilia curae duis faucibus accumsan,Message,1,2/21/24
933,808,1000,magna vulputate luctus cum sociis natoque penatibus et magnis dis,Message,0,2/5/24
934,670,216,ac tellus semper interdum mauris ullamcorper purus sit,Message,1,2/11/24
935,467,669,nulla sed accumsan felis ut,Message,0,2/22/24
936,593,644,ipsum praesent blandit lacinia erat vestibulum sed magna at nunc,Message,0,2/8/24
937,170,604,justo maecenas rhoncus aliquam lacus morbi quis tortor id,Message,0,2/15/24
938,308,430,risus dapibus augue vel accumsan tellus nisi eu orci,Message,1,2/25/24
939,707,958,et eros vestibulum ac est lacinia nisi venenatis tristique fusce,Message,0,2/24/24
940,840,471,hac habitasse platea dictumst morbi vestibulum velit,Message,1,2/18/24
941,365,372,nibh in lectus pellentesque at nulla suspendisse,Message,1,2/6/24
942,436,105,sapien arcu sed augue aliquam erat volutpat in congue etiam,Message,0,2/16/24
943,196,383,mauris non ligula pellentesque ultrices phasellus id sapien,Message,0,2/25/24
944,614,50,in faucibus orci luctus et ultrices posuere,Message,1,2/24/24
945,499,289,eu nibh quisque id justo sit amet sapien,Message,0,2/4/24
946,661,290,pharetra magna vestibulum aliquet ultrices erat tortor,Message,0,2/6/24
947,293,898,viverra eget congue eget semper rutrum nulla nunc purus,Message,1,2/6/24
948,982,901,turpis a pede posuere nonummy,Message,1,2/9/24
949,723,20,justo in blandit ultrices enim lorem ipsum,Message,1,2/16/24
950,286,846,donec odio justo sollicitudin ut suscipit a feugiat,Message,1,2/5/24
951,593,829,primis in faucibus orci luctus et ultrices,Message,1,2/6/24
952,211,863,vestibulum ante ipsum primis in faucibus orci luctus et ultrices,Message,0,2/12/24
953,586,205,potenti in eleifend quam a odio in hac,Message,1,2/1/24
954,584,336,odio odio elementum eu interdum,Message,1,2/2/24
955,610,229,luctus rutrum nulla tellus in sagittis,Message,0,2/12/24
956,98,79,in faucibus orci luctus et ultrices,Message,1,2/4/24
957,526,613,posuere cubilia curae mauris viverra diam vitae quam suspendisse,Message,1,2/13/24
958,956,1,felis sed lacus morbi sem,Message,1,2/3/24
959,410,736,cras non velit nec nisi vulputate nonummy maecenas tincidunt lacus,Message,1,2/1/24
960,861,104,integer tincidunt ante vel ipsum,Message,0,2/20/24
961,518,289,ipsum dolor sit amet consectetuer adipiscing elit proin,Message,1,2/6/24
962,392,955,sagittis sapien cum sociis natoque penatibus et magnis,Message,1,2/5/24
963,328,724,eget eleifend luctus ultricies eu nibh,Message,0,2/15/24
964,469,30,morbi a ipsum integer a nibh in quis justo,Message,1,2/13/24
965,389,816,pulvinar sed nisl nunc rhoncus dui vel sem sed,Message,0,2/10/24
966,356,842,posuere cubilia curae nulla dapibus dolor vel est,Message,0,2/7/24
967,112,183,vestibulum sed magna at nunc commodo placerat praesent,Message,1,2/23/24
968,520,440,felis eu sapien cursus vestibulum proin eu mi,Message,0,2/10/24
969,906,320,eget congue eget semper rutrum nulla nunc purus,Message,1,2/19/24
970,822,870,id ligula suspendisse ornare consequat lectus in,Message,0,2/16/24
971,5,878,tristique in tempus sit amet sem fusce,Message,0,2/9/24
972,82,27,ut suscipit a feugiat et eros vestibulum,Message,0,2/18/24
973,543,169,interdum mauris ullamcorper purus sit amet,Message,1,2/5/24
974,35,688,ante vivamus tortor duis mattis egestas metus aenean fermentum,Message,0,2/15/24
975,287,116,libero convallis eget eleifend luctus ultricies eu nibh,Message,1,2/24/24
976,812,547,gravida nisi at nibh in hac,Message,0,2/6/24
977,297,772,feugiat et eros vestibulum ac,Message,0,2/13/24
978,904,594,nunc donec quis orci eget orci vehicula condimentum curabitur in,Message,0,2/15/24
979,304,1000,in blandit ultrices enim lorem,Message,0,2/5/24
980,73,22,id ligula suspendisse ornare consequat lectus in est risus auctor,Message,0,2/19/24
