Post_id,User_id,Recipient_id,Content,Type_is,Visible,Created_at
331,983,162,morbi non quam nec dui luctus rutrum nulla tellus,Message,0,2/10/24
332,971,917,id ornare imperdiet sapien urna pretium nisl ut,Message,0,2/23/24
333,969,550,nunc proin at turpis a,Message,1,2/8/24
334,465,303,eleifend luctus ultricies eu nibh quisque id,Message,0,2/1/24
335,810,435,justo sollicitudin ut suscipit a,Message,0,2/1/24
336,900,265,semper sapien a libero nam dui proin,Message,0,2/23/24
337,594,636,ante ipsum primis in faucibus orci,Message,1,2/15/24
338,692,247,in hac habitasse platea dictumst aliquam augue,Message,0,2/10/24
339,97,796,duis mattis egestas metus aenean fermentum donec ut mauris eget,Message,0,2/15/24
340,30,673,faucibus accumsan odio curabitur convallis duis consequat,Message,1,2/18/24
341,169,455,varius integer ac leo pellentesque ultrices mattis odio donec vitae,Message,0,2/4/24
342,222,946,scelerisque mauris sit amet eros suspendisse accumsan tortor quis,Message,1,2/16/24
343,392,552,sit amet consectetuer adipiscing elit proin risus praesent lectus vestibulum,Message,1,2/16/24
344,839,166,pulvinar sed nisl nunc rhoncus,Message,0,2/4/24
345,117,203,integer ac neque duis bibendum morbi non quam nec,Message,0,2/22/24
346,436,102,sapien iaculis congue vivamus metus,Message,0,2/4/24
347,439,970,pede justo lacinia eget tincidunt eget tempus vel,Message,0,2/4/24
348,975,500,metus vitae ipsum aliquam non mauris morbi non,Message,0,2/13/24
349,892,472,vivamus in felis eu sapien,Message,0,2/18/24
350,934,871,nisl ut volutpat sapien arcu sed augue aliquam,Message,0,2/25/24
351,903,284,ac leo pellentesque ultrices mattis odio donec vitae nisi nam,Message,0,2/20/24
352,510,420,viverra pede ac diam cras pellentesque volutpat,Message,1,2/6/24
353,498,276,elementum pellentesque quisque porta volutpat erat quisque erat eros,Message,1,2/19/24
354,507,846,nonummy integer non velit donec diam neque vestibulum eget vulputate,Message,0,2/2/24
355,180,703,elit ac nulla sed vel enim sit amet nunc,Message,1,2/20/24
356,605,181,mauris laoreet ut rhoncus aliquet pulvinar sed nisl,Message,1,2/11/24
357,330,762,lacinia nisi venenatis tristique fusce congue,Message,1,2/7/24
358,3,773,habitasse platea dictumst morbi vestibulum velit,Message,1,2/10/24
359,940,63,suscipit nulla elit ac nulla sed vel,Message,0,2/10/24
360,34,524,ut tellus nulla ut erat id,Message,0,2/16/24
361,833,370,consequat lectus in est risus auctor sed tristique in tempus,Message,1,2/9/24
362,251,212,cursus urna ut tellus nulla ut erat,Message,0,2/21/24
363,778,50,nulla sed accumsan felis ut at dolor quis,Message,0,2/15/24
364,955,704,integer pede justo lacinia eget tincidunt eget tempus vel,Message,0,2/13/24
365,789,837,donec semper sapien a libero,Message,1,2/25/24
366,740,820,elementum in hac habitasse platea dictumst morbi vestibulum velit id,Message,1,2/1/24
367,86,256,eros suspendisse accumsan tortor quis turpis sed,Message,0,2/12/24
368,849,828,vehicula consequat morbi a ipsum integer a,Message,1,2/15/24
369,449,643,nulla quisque arcu libero rutrum ac lobortis,Message,0,2/21/24
370,541,727,lacinia aenean sit amet justo morbi ut odio cras,Message,1,2/21/24
371,608,299,ante vivamus tortor duis mattis egestas,Message,1,2/1/24
372,198,834,vitae mattis nibh ligula nec sem duis,Message,0,2/10/24
373,440,180,enim lorem ipsum dolor sit amet consectetuer adipiscing,Message,1,2/15/24
374,278,623,primis in faucibus orci luctus et ultrices,Message,1,2/15/24
375,770,427,ante ipsum primis in faucibus orci luctus et ultrices posuere,Message,1,2/7/24
376,349,809,hac habitasse platea dictumst aliquam augue,Message,0,2/4/24
377,32,406,semper porta volutpat quam pede,Message,1,2/12/24
378,914,303,lorem ipsum dolor sit amet,Message,1,2/16/24
379,120,214,integer tincidunt ante vel ipsum,Message,0,2/14/24
380,178,913,adipiscing lorem vitae mattis nibh ligula nec sem,Message,0,2/24/24
381,409,803,amet erat nulla tempus vivamus in felis,Message,0,2/14/24
382,983,98,posuere nonummy integer non velit donec diam,Message,1,2/11/24
383,788,140,morbi odio odio elementum eu interdum eu tincidunt in,Message,1,2/14/24
384,339,385,luctus nec molestie sed justo pellentesque,Message,0,2/23/24
385,217,606,orci vehicula condimentum curabitur in libero ut massa volutpat convallis,Message,0,2/16/24
386,346,418,leo pellentesque ultrices mattis odio donec vitae nisi nam ultrices,Message,1,2/15/24
387,520,622,pulvinar lobortis est phasellus sit amet erat nulla tempus,Message,0,2/18/24
388,626,132,tellus nulla ut erat id mauris,Message,1,2/11/24
389,402,668,ut suscipit a feugiat et eros vestibulum ac,Message,0,2/18/24
390,80,506,odio consequat varius integer ac leo pellentesque ultrices mattis,Message,0,2/16/24
391,847,414,mauris vulputate elementum nullam varius nulla facilisi,Message,1,2/23/24
392,741,847,tortor risus dapibus augue vel accumsan tellus nisi eu orci,Message,0,2/7/24
393,863,455,odio donec vitae nisi nam ultrices libero non mattis,Message,1,2/15/24
394,168,787,augue vestibulum rutrum rutrum neque aenean auctor gravida sem praesent,Message,0,2/12/24
395,713,693,magnis dis parturient montes nascetur ridiculus mus etiam,Message,1,2/13/24
396,562,734,molestie lorem quisque ut erat curabitur gravida nisi,Message,1,2/25/24
397,694,524,faucibus orci luctus et ultrices posuere cubilia curae mauris,Message,0,2/6/24
398,746,997,rhoncus aliquet pulvinar sed nisl nunc,Message,1,2/7/24
399,947,507,diam neque vestibulum eget vulputate ut ultrices,Message,1,2/11/24
400,550,443,habitasse platea dictumst aliquam augue quam sollicitudin,Message,0,2/17/24
401,17,828,turpis sed ante vivamus tortor duis mattis egestas metus aenean,Message,1,2/2/24
402,69,382,vivamus tortor duis mattis egestas metus aenean fermentum donec,Message,0,2/9/24
403,435,933,justo nec condimentum neque sapien placerat ante nulla justo,Message,0,2/13/24
404,892,250,accumsan odio curabitur convallis duis consequat,Message,0,2/20/24
405,761,583,tempor convallis nulla neque libero convallis eget eleifend,Message,1,2/3/24
406,142,597,dictumst etiam faucibus cursus urna,Message,0,2/21/24
407,682,494,at nulla suspendisse potenti cras in,Message,1,2/12/24
408,79,65,posuere cubilia curae duis faucibus accumsan,Message,0,2/10/24
409,767,137,malesuada in imperdiet et commodo vulputate justo in blandit,Message,0,2/15/24
410,757,115,dis parturient montes nascetur ridiculus mus etiam vel augue,Message,0,2/10/24
411,958,465,ipsum praesent blandit lacinia erat vestibulum sed magna,Message,1,2/20/24
412,333,995,duis bibendum felis sed interdum venenatis turpis,Message,0,2/18/24
413,447,412,non sodales sed tincidunt eu felis fusce,Message,0,2/14/24
414,383,882,metus arcu adipiscing molestie hendrerit at vulputate vitae nisl aenean,Message,1,2/10/24
415,123,260,ultrices posuere cubilia curae nulla dapibus dolor vel est donec,Message,1,2/20/24
416,861,577,nulla tempus vivamus in felis eu sapien cursus vestibulum,Message,1,2/20/24
417,901,923,convallis tortor risus dapibus augue vel accumsan,Message,1,2/3/24
418,750,224,dolor sit amet consectetuer adipiscing elit proin risus praesent lectus,Message,1,2/5/24
419,487,98,integer a nibh in quis justo maecenas,Message,1,2/3/24
420,300,210,ultrices vel augue vestibulum ante ipsum primis in faucibus orci,Message,0,2/22/24
421,664,511,eget eros elementum pellentesque quisque porta volutpat,Message,1,2/5/24
422,432,416,cum sociis natoque penatibus et magnis dis parturient montes,Message,1,2/4/24
423,25,889,aliquam quis turpis eget elit sodales scelerisque,Message,0,2/21/24
424,488,301,curae duis faucibus accumsan odio,Message,1,2/6/24
425,796,697,ornare imperdiet sapien urna pretium nisl ut volutpat sapien,Message,0,2/11/24
426,147,966,elit sodales scelerisque mauris sit amet eros suspendisse,Message,0,2/1/24
427,875,550,mauris vulputate elementum nullam varius nulla facilisi cras non velit,Message,0,2/16/24
428,194,496,dolor morbi vel lectus in quam,Message,0,2/7/24
429,194,567,luctus et ultrices posuere cubilia curae donec pharetra magna vestibulum,Message,1,2/5/24
430,449,837,eleifend pede libero quis orci nullam molestie nibh in lectus,Message,1,2/3/24
431,550,587,phasellus sit amet erat nulla,Message,0,2/6/24
432,681,161,mus etiam vel augue vestibulum rutrum rutrum neque,Message,1,2/3/24
433,8,503,dictumst aliquam augue quam sollicitudin vitae consectetuer,Message,0,2/10/24
434,1,331,venenatis turpis enim blandit mi in porttitor,Message,0,2/1/24
435,489,579,mus vivamus vestibulum sagittis sapien,Message,0,2/16/24
436,566,529,eget tempus vel pede morbi porttitor lorem,Message,0,2/13/24
437,111,140,sit amet sapien dignissim vestibulum vestibulum ante ipsum primis,Message,1,2/7/24
438,83,847,pulvinar sed nisl nunc rhoncus dui,Message,1,2/1/24
439,809,74,eget vulputate ut ultrices vel augue vestibulum ante ipsum primis,Message,0,2/25/24
440,29,334,donec vitae nisi nam ultrices libero non mattis pulvinar nulla,Message,1,2/10/24
441,235,404,convallis nulla neque libero convallis,Message,0,2/20/24
442,420,96,pulvinar lobortis est phasellus sit amet erat nulla tempus,Message,0,2/13/24
443,468,784,cursus id turpis integer aliquet massa id,Message,1,2/5/24
444,145,56,et ultrices posuere cubilia curae mauris viverra diam,Message,1,2/6/24
445,458,34,ut nulla sed accumsan felis ut at dolor quis odio,Message,0,2/19/24
446,217,363,massa id lobortis convallis tortor risus dapibus augue vel accumsan,Message,1,2/13/24
447,209,819,ac tellus semper interdum mauris ullamcorper purus sit amet nulla,Message,0,2/9/24
448,320,881,purus aliquet at feugiat non pretium quis lectus suspendisse potenti,Message,0,2/16/24
449,797,445,adipiscing elit proin risus praesent lectus vestibulum quam sapien,Message,0,2/2/24
450,330,771,lacinia erat vestibulum sed magna,Message,1,2/16/24
451,87,985,faucibus orci luctus et ultrices posuere cubilia curae,Message,1,2/12/24
452,414,881,neque duis bibendum morbi non quam nec,Message,1,2/1/24
453,563,710,fusce consequat nulla nisl nunc nisl duis bibendum,Message,0,2/24/24
454,282,707,vel enim sit amet nunc,Message,1,2/18/24
455,712,177,ultrices posuere cubilia curae nulla dapibus dolor,Message,1,2/5/24
456,514,666,condimentum curabitur in libero ut,Message,1,2/1/24
457,741,671,cursus id turpis integer aliquet massa id lobortis convallis tortor,Message,0,2/18/24
458,139,572,quam suspendisse potenti nullam porttitor lacus,Message,0,2/1/24
459,25,957,nisi at nibh in hac habitasse platea dictumst aliquam,Message,0,2/1/24
460,600,915,curae duis faucibus accumsan odio,Message,1,2/12/24
461,229,494,interdum eu tincidunt in leo,Message,0,2/21/24
462,685,409,platea dictumst etiam faucibus cursus urna ut tellus nulla ut,Message,1,2/22/24
463,100,45,orci pede venenatis non sodales,Message,0,2/8/24
464,555,226,at lorem integer tincidunt ante vel ipsum praesent,Message,0,2/16/24
465,487,332,mus etiam vel augue vestibulum rutrum rutrum neque aenean,Message,1,2/7/24
466,750,387,ante vestibulum ante ipsum primis in,Message,1,2/5/24
467,341,516,dignissim vestibulum vestibulum ante ipsum primis in faucibus orci luctus,Message,1,2/10/24
468,821,332,blandit non interdum in ante,Message,0,2/1/24
469,538,523,pede ullamcorper augue a suscipit nulla elit ac,Message,0,2/9/24
470,378,841,aenean lectus pellentesque eget nunc donec quis orci eget,Message,1,2/15/24
471,58,518,aenean fermentum donec ut mauris eget massa,Message,0,2/21/24
472,766,767,orci luctus et ultrices posuere cubilia curae,Message,1,2/9/24
473,183,906,etiam vel augue vestibulum rutrum rutrum neque,Message,1,2/3/24
474,482,92,id ornare imperdiet sapien urna pretium nisl ut volutpat sapien,Message,0,2/23/24
475,733,49,ultrices vel augue vestibulum ante ipsum primis in faucibus orci,Message,1,2/21/24
476,369,459,quisque id justo sit amet sapien dignissim vestibulum vestibulum,Message,1,2/20/24
477,381,216,primis in faucibus orci luctus et ultrices,Message,0,2/22/24
478,63,780,pellentesque viverra pede ac diam cras pellentesque volutpat dui,Message,0,2/2/24
479,967,830,odio curabitur convallis duis consequat,Message,1,2/21/24
480,61,690,ipsum integer a nibh in,Message,0,2/4/24
481,185,293,enim leo rhoncus sed vestibulum sit amet cursus id,Message,0,2/15/24
482,771,336,eleifend luctus ultricies eu nibh,Message,1,2/19/24
483,914,102,felis fusce posuere felis sed lacus morbi sem mauris laoreet,Message,0,2/14/24
484,772,837,lectus suspendisse potenti in eleifend quam a odio,Message,0,2/21/24
485,807,979,ligula suspendisse ornare consequat lectus in est risus auctor sed,Message,0,2/18/24
486,301,987,et ultrices posuere cubilia curae donec pharetra magna vestibulum,Message,0,2/13/24
487,340,603,aliquet ultrices erat tortor sollicitudin mi sit amet lobortis sapien,Message,1,2/11/24
488,93,219,semper porta volutpat quam pede lobortis ligula sit,Message,0,2/16/24
489,326,161,nullam orci pede venenatis non sodales sed tincidunt eu felis,Message,0,2/13/24
490,703,400,interdum venenatis turpis enim blandit mi in porttitor pede,Message,0,2/12/24
491,333,693,posuere cubilia curae duis faucibus accumsan odio curabitur convallis,Message,0,2/24/24
492,440,341,donec ut dolor morbi vel lectus in quam,Message,0,2/21/24
493,535,423,est congue elementum in hac habitasse,Message,0,2/17/24
494,958,393,nec euismod scelerisque quam turpis,Message,0,2/25/24
495,632,536,etiam faucibus cursus urna ut tellus nulla ut erat id,Message,1,2/11/24
496,850,899,dolor vel est donec odio,Message,1,2/22/24
497,817,115,vestibulum sagittis sapien cum sociis,Message,0,2/25/24
498,468,560,velit id pretium iaculis diam erat fermentum justo,Message,1,2/3/24
499,937,132,consequat nulla nisl nunc nisl,Message,1,2/24/24
500,986,268,ultrices mattis odio donec vitae nisi nam,Message,1,2/17/24
501,3,311,consequat in consequat ut nulla sed,Message,1,2/1/24
502,386,804,augue quam sollicitudin vitae consectetuer,Message,0,2/12/24
503,857,728,suspendisse ornare consequat lectus in est risus auctor sed tristique,Message,1,2/6/24
504,198,808,in magna bibendum imperdiet nullam orci,Message,1,2/24/24
505,964,955,eros elementum pellentesque quisque porta,Message,1,2/1/24
506,56,143,quam turpis adipiscing lorem vitae,Message,1,2/18/24
507,569,300,id pretium iaculis diam erat fermentum justo nec condimentum,Message,1,2/7/24
508,70,186,nam ultrices libero non mattis pulvinar nulla pede ullamcorper,Message,0,2/5/24
509,126,2,vitae ipsum aliquam non mauris morbi non lectus aliquam sit,Message,1,2/1/24
510,481,62,quisque porta volutpat erat quisque erat eros viverra eget congue,Message,0,2/8/24
511,208,662,cubilia curae mauris viverra diam vitae quam suspendisse,Message,1,2/5/24
512,842,634,non ligula pellentesque ultrices phasellus,Message,0,2/19/24
513,411,43,nonummy integer non velit donec,Message,0,2/1/24
514,742,91,amet turpis elementum ligula vehicula consequat morbi a ipsum,Message,1,2/11/24
515,709,92,ut suscipit a feugiat et,Message,0,2/22/24
516,224,305,fermentum justo nec condimentum neque sapien placerat,Message,0,2/23/24
517,562,597,quis turpis sed ante vivamus tortor duis mattis,Message,1,2/18/24
518,103,159,nunc vestibulum ante ipsum primis in faucibus,Message,1,2/13/24
519,773,328,curabitur at ipsum ac tellus semper interdum mauris,Message,0,2/25/24
520,133,258,sit amet sapien dignissim vestibulum vestibulum,Message,0,2/25/24
521,125,8,nunc rhoncus dui vel sem sed,Message,0,2/3/24
522,978,856,ridiculus mus vivamus vestibulum sagittis sapien,Message,0,2/14/24
523,126,870,imperdiet nullam orci pede venenatis non sodales sed tincidunt eu,Message,0,2/4/24
524,307,533,metus aenean fermentum donec ut mauris eget massa tempor convallis,Message,1,2/6/24
525,68,477,ornare consequat lectus in est risus auctor sed,Message,1,2/16/24
526,199,652,imperdiet et commodo vulputate justo in blandit,Message,1,2/11/24
527,1000,768,nulla tempus vivamus in felis eu sapien cursus vestibulum,Message,0,2/7/24
528,395,384,tempus sit amet sem fusce consequat nulla nisl nunc nisl,Message,1,2/1/24
529,37,791,primis in faucibus orci luctus et,Message,1,2/15/24
530,372,322,purus aliquet at feugiat non pretium quis lectus,Message,0,2/13/24
531,569,137,donec posuere metus vitae ipsum aliquam non mauris,Message,1,2/16/24
532,204,829,ipsum primis in faucibus orci luctus,Message,0,2/2/24
533,801,372,amet consectetuer adipiscing elit proin interdum mauris non,Message,1,2/7/24
534,914,489,libero nullam sit amet turpis elementum ligula vehicula,Message,1,2/24/24
535,230,413,sapien ut nunc vestibulum ante ipsum primis in faucibus orci,Message,0,2/6/24
536,302,532,nibh in quis justo maecenas rhoncus aliquam lacus,Message,0,2/18/24
537,661,106,augue vestibulum rutrum rutrum neque aenean auctor gravida,Message,1,2/21/24
538,383,570,est phasellus sit amet erat nulla tempus vivamus,Message,1,2/16/24
539,162,505,amet nunc viverra dapibus nulla suscipit ligula in,Message,1,2/20/24
540,879,635,sapien urna pretium nisl ut volutpat,Message,1,2/1/24
541,969,501,suspendisse potenti in eleifend quam a odio in hac habitasse,Message,1,2/9/24
542,154,211,et ultrices posuere cubilia curae,Message,0,2/9/24
543,741,854,arcu sed augue aliquam erat volutpat in congue etiam justo,Message,1,2/14/24
544,401,287,felis eu sapien cursus vestibulum proin eu mi,Message,0,2/24/24
545,350,852,interdum eu tincidunt in leo maecenas,Message,1,2/16/24
546,439,723,iaculis diam erat fermentum justo nec,Message,1,2/7/24
547,725,507,libero nullam sit amet turpis elementum ligula vehicula consequat,Message,0,2/13/24
548,273,602,convallis morbi odio odio elementum eu,Message,0,2/6/24
549,751,736,in sagittis dui vel nisl duis,Message,1,2/22/24
550,575,132,tristique fusce congue diam id ornare imperdiet sapien urna,Message,1,2/11/24
551,588,19,duis bibendum felis sed interdum,Message,0,2/4/24
552,339,281,imperdiet et commodo vulputate justo in,Message,1,2/24/24
553,621,316,porta volutpat erat quisque erat,Message,1,2/6/24
554,622,517,aliquet pulvinar sed nisl nunc rhoncus dui vel,Message,1,2/19/24
555,539,696,congue eget semper rutrum nulla nunc purus phasellus in,Message,1,2/3/24
556,415,68,ridiculus mus vivamus vestibulum sagittis sapien cum sociis natoque penatibus,Message,0,2/18/24
557,716,859,est risus auctor sed tristique in tempus sit,Message,1,2/9/24
558,995,87,elit sodales scelerisque mauris sit amet eros suspendisse accumsan,Message,1,2/1/24
559,840,287,eget rutrum at lorem integer tincidunt ante vel ipsum,Message,1,2/21/24
560,293,646,tincidunt in leo maecenas pulvinar lobortis est phasellus,Message,0,2/17/24
561,387,146,massa quis augue luctus tincidunt nulla mollis molestie lorem quisque,Message,1,2/6/24
562,695,496,dui vel nisl duis ac nibh,Message,1,2/8/24
563,992,862,dolor sit amet consectetuer adipiscing elit proin,Message,1,2/4/24
564,331,794,congue diam id ornare imperdiet sapien urna pretium nisl,Message,0,2/19/24
565,989,322,consequat metus sapien ut nunc vestibulum ante ipsum,Message,0,2/5/24
566,517,509,massa id lobortis convallis tortor risus dapibus,Message,0,2/15/24
567,368,725,vulputate justo in blandit ultrices enim lorem ipsum,Message,1,2/8/24
568,246,658,vulputate elementum nullam varius nulla facilisi cras,Message,0,2/21/24
569,513,850,odio cras mi pede malesuada,Message,0,2/2/24
570,138,550,amet eleifend pede libero quis orci,Message,1,2/24/24
571,546,939,gravida nisi at nibh in hac,Message,1,2/9/24
572,387,995,lacus at turpis donec posuere metus vitae ipsum aliquam,Message,1,2/6/24
573,154,377,sem sed sagittis nam congue risus,Message,0,2/17/24
574,419,39,mauris ullamcorper purus sit amet nulla,Message,0,2/20/24
575,587,996,amet consectetuer adipiscing elit proin interdum mauris non,Message,0,2/23/24
576,364,437,erat vestibulum sed magna at nunc commodo placerat,Message,0,2/12/24
577,526,423,sem praesent id massa id nisl,Message,1,2/14/24
578,77,297,consequat varius integer ac leo,Message,0,2/23/24
579,702,10,platea dictumst aliquam augue quam sollicitudin vitae consectetuer eget rutrum,Message,0,2/4/24
580,77,162,turpis integer aliquet massa id lobortis convallis tortor risus,Message,1,2/14/24
581,347,632,cubilia curae donec pharetra magna vestibulum aliquet ultrices,Message,0,2/11/24
582,317,403,et eros vestibulum ac est lacinia nisi venenatis tristique fusce,Message,0,2/19/24
583,654,124,eu felis fusce posuere felis sed lacus,Message,1,2/12/24
584,462,94,tortor id nulla ultrices aliquet maecenas leo odio condimentum id,Message,0,2/10/24
585,838,552,dapibus at diam nam tristique tortor eu,Message,1,2/10/24
586,810,953,odio donec vitae nisi nam ultrices libero non,Message,1,2/10/24
587,519,197,sit amet lobortis sapien sapien non mi integer ac,Message,0,2/24/24
588,336,65,orci luctus et ultrices posuere cubilia curae nulla dapibus dolor,Message,0,2/6/24
589,984,282,consectetuer adipiscing elit proin interdum mauris non ligula pellentesque ultrices,Message,1,2/14/24
590,798,944,sodales sed tincidunt eu felis fusce posuere felis,Message,0,2/19/24
591,688,170,at turpis donec posuere metus vitae ipsum aliquam non,Message,0,2/17/24
592,943,89,platea dictumst morbi vestibulum velit id pretium iaculis diam erat,Message,0,2/13/24
593,716,941,nunc commodo placerat praesent blandit nam nulla integer,Message,1,2/9/24
594,947,159,luctus et ultrices posuere cubilia curae donec pharetra magna vestibulum,Message,0,2/6/24
595,397,947,rhoncus mauris enim leo rhoncus sed vestibulum sit amet cursus,Message,1,2/25/24
596,607,371,ligula pellentesque ultrices phasellus id sapien in sapien iaculis congue,Message,0,2/6/24
597,348,297,magna ac consequat metus sapien ut nunc vestibulum,Message,1,2/19/24
598,709,910,euismod scelerisque quam turpis adipiscing lorem vitae mattis nibh ligula,Message,0,2/12/24
599,320,16,nulla ut erat id mauris vulputate,Message,1,2/12/24
600,104,885,rutrum ac lobortis vel dapibus at diam nam tristique,Message,1,2/8/24
601,873,542,ut ultrices vel augue vestibulum ante ipsum primis,Message,1,2/19/24
602,163,523,justo lacinia eget tincidunt eget tempus vel pede morbi,Message,0,2/20/24
603,620,197,vestibulum ante ipsum primis in,Message,1,2/4/24
604,933,470,orci luctus et ultrices posuere cubilia curae mauris viverra,Message,1,2/15/24
605,857,967,donec dapibus duis at velit eu est congue,Message,0,2/2/24
606,621,41,lacus morbi sem mauris laoreet ut,Message,1,2/22/24
607,81,949,integer a nibh in quis justo,Message,1,2/24/24
608,710,844,lacinia erat vestibulum sed magna at nunc commodo placerat praesent,Message,0,2/3/24
609,177,515,sed ante vivamus tortor duis mattis egestas metus aenean,Message,1,2/23/24
610,272,519,tortor duis mattis egestas metus aenean fermentum donec ut,Message,1,2/15/24
611,847,73,arcu sed augue aliquam erat,Message,1,2/15/24
612,509,47,eu interdum eu tincidunt in leo maecenas pulvinar,Message,0,2/5/24
613,128,757,parturient montes nascetur ridiculus mus etiam vel augue vestibulum rutrum,Message,1,2/16/24
614,761,881,posuere nonummy integer non velit donec diam,Message,1,2/16/24
615,624,169,semper interdum mauris ullamcorper purus sit amet,Message,1,2/22/24
616,590,467,justo pellentesque viverra pede ac diam,Message,1,2/11/24
617,802,902,vestibulum ante ipsum primis in faucibus,Message,1,2/5/24
618,483,438,donec quis orci eget orci vehicula condimentum,Message,0,2/14/24
619,123,46,nulla tempus vivamus in felis eu sapien cursus vestibulum,Message,0,2/7/24
620,885,796,in leo maecenas pulvinar lobortis est,Message,1,2/22/24
621,244,283,lacus at velit vivamus vel nulla eget eros elementum,Message,0,2/19/24
622,748,612,sit amet erat nulla tempus,Message,1,2/4/24
623,183,570,ullamcorper augue a suscipit nulla elit ac nulla sed,Message,1,2/20/24
624,378,743,libero non mattis pulvinar nulla,Message,0,2/11/24
625,292,360,suscipit ligula in lacus curabitur at,Message,1,2/14/24
626,525,178,amet sapien dignissim vestibulum vestibulum ante,Message,0,2/1/24
627,968,832,ligula suspendisse ornare consequat lectus in,Message,0,2/18/24
628,65,128,interdum mauris ullamcorper purus sit amet nulla quisque arcu libero,Message,1,2/17/24
629,132,436,tempor turpis nec euismod scelerisque quam turpis adipiscing lorem,Message,0,2/3/24
630,100,779,quisque id justo sit amet sapien dignissim vestibulum vestibulum ante,Message,1,2/24/24
631,815,217,iaculis justo in hac habitasse platea dictumst etiam,Message,0,2/15/24
632,792,999,in purus eu magna vulputate luctus cum sociis natoque,Message,1,2/5/24
633,192,858,sed interdum venenatis turpis enim blandit mi in porttitor pede,Message,0,2/12/24
634,346,743,nisl venenatis lacinia aenean sit,Message,0,2/12/24
635,113,507,lacinia nisi venenatis tristique fusce,Message,0,2/15/24
636,276,496,dui proin leo odio porttitor id consequat in consequat ut,Message,0,2/15/24
637,257,19,sapien varius ut blandit non interdum in,Message,0,2/15/24
638,265,219,urna pretium nisl ut volutpat,Message,0,2/25/24
639,419,615,turpis elementum ligula vehicula consequat morbi a,Message,0,2/17/24
640,811,427,a libero nam dui proin leo odio porttitor id,Message,1,2/13/24
641,208,68,enim leo rhoncus sed vestibulum sit amet cursus,Message,0,2/11/24
642,351,112,lorem quisque ut erat curabitur gravida nisi,Message,1,2/16/24
643,150,988,nulla neque libero convallis eget eleifend,Message,1,2/18/24
644,93,846,ac leo pellentesque ultrices mattis,Message,1,2/2/24
645,435,749,duis consequat dui nec nisi volutpat,Message,1,2/25/24
646,768,885,cras non velit nec nisi vulputate nonummy,Message,0,2/22/24
647,143,972,tortor id nulla ultrices aliquet maecenas leo odio condimentum,Message,0,2/7/24
648,547,182,at ipsum ac tellus semper interdum mauris ullamcorper purus,Message,0,2/11/24
649,416,778,sociis natoque penatibus et magnis dis,Message,1,2/21/24
650,401,961,ut dolor morbi vel lectus in quam fringilla,Message,1,2/15/24
651,8,525,ut at dolor quis odio consequat varius integer,Message,0,2/4/24
